url,title,body,date,body_clean,body_nostop,body_stemmed
https://www.kompasiana.com/pangestuadikaputra/69097fda34777c1c7e4e1583/walau-tidak-menjadikan-kaya-raya-tempatmu-bekerja-saat-ini-membuatmu-tetap-hidup,"Walau Tidak Menjadikan Kaya Raya, Tempatmu Bekerja Saat Ini Membuatmu Tetap Hidup","
Sepahit apapun realitanya, walau tidak membuat kita kaya raya, setidaknya perusahaan tempat kita bekerja saat ini membuat kita tetap hidup . Dari situlah dapur kita tetap bisa mengepul, anak tetap bisa sekolah, istri tetap bisa senyum, Iuran warga tetap terbayar, pulsa tetap terbeli, listrik dan air tidak sampai di putus.
Tidak ada pekerjaan yang ideal, seaman-amannya ASN, senyaman-nyamannya pegawai BUMN, seideal-idealnya karyawan di perusahaan bonafid hingga seenjoy-enjoynya freelancer digitalpun tetap saja punya ketidaknyamanannya sendiri-sendiri. Intinya sama, kita bekerja ikut dan untuk entitas yang secara kemampuan lebih besar dari kita. Besar ataupun kecil, dimanapun tekanan akan tetap selalu ada. Hanya beda bentuk.

Kalau masih berpikir ""kita yang bekerja keras, bosnya yang kaya raya"" artinya belum dewasa. Sesederhana anak kecil yang malas berangkat sekolah lalu bilang ""ayah sama ibu enak ya gak sekolah, gak pernah mengerjakan PR, gak pernah piket kelas"". Ya persis seperti itu situasinya.

Saya tidak sedang membela siapapun, baik bos maupun pekerja seperti saya ini. Ini bukan soal membela siapa, ini soal kesadaran diri. Tidak sekali dua kali saya mendapati sesama ""pekerja"" menggerutu dan mengeluh soal capeknya bekerja. Seringkali muncul rencana mau resign, mau keluar dan mencari pekerjaan baru yang lebih oke.
Boleh, dan saya selalu mendukung siapapun teman maupun saudara untuk maju dan lebih baik. Namun sebelum ke arah situ, tidak ada salahnya kita mencoba untuk berpikir sejenak.
Kalau hanya karena capek, pekerjaan mana yang tidak capek? kalau hanya karena tekanan, pekerjaan mana yang tidak ada tekanan? kalau soal salary, pekerjaan mana yang bisa langsung kasih salari puluhan juta?
Oke, kalaupun memang dibeberapa situasi ada pekerjaan-pekerjaan tertentu yang minim tekanan, kerja santai, gaji besar.

Tetapi perlu kita sadari juga, berapa besar ketersediaan pekerjaan yang demikian itu? at least kualifikasi apa yang dibutuhkan untuk pekerjaan yang seperti itu?

Tulisan ini berangkat dari narasi-narasi yang muncul dari konten-konten di media sosial. Intinya soal ""kita yang bekerja keras, bosnya yang kaya raya"" dan seringkali selalu dikaitkan dengan mental health. Sebuah konsep kesehatan yang bahkan saya pun tidak terlalu paham.
Ngomong-ngomong soal kontan, mental health dan media sosial. Disaat yang sama juga muncul narasi-narasi yang justri datang dari dimensi perusahaan. Ini yang menjadi sorotan adalah mengenai etos kerja Generasi muda yang dianggap kurang greget. Selain masalah etos, banyak juga soal isu kompetensi.",,sepahit apapun realitanya walau tidak membuat kita kaya raya setidaknya perusahaan tempat kita bekerja saat ini membuat kita tetap hidup  dari situlah dapur kita tetap bisa mengepul anak tetap bisa sekolah istri tetap bisa senyum iuran warga tetap terbayar pulsa tetap terbeli listrik dan air tidak sampai di putus tidak ada pekerjaan yang ideal seamanamannya asn senyamannyamannya pegawai bumn seidealidealnya karyawan di perusahaan bonafid hingga seenjoyenjoynya freelancer digitalpun tetap saja punya ketidaknyamanannya sendirisendiri intinya sama kita bekerja ikut dan untuk entitas yang secara kemampuan lebih besar dari kita besar ataupun kecil dimanapun tekanan akan tetap selalu ada hanya beda bentuk kalau masih berpikir kita yang bekerja keras bosnya yang kaya raya artinya belum dewasa sesederhana anak kecil yang malas berangkat sekolah lalu bilang ayah sama ibu enak ya gak sekolah gak pernah mengerjakan pr gak pernah piket kelas ya persis seperti itu situasinya saya tidak sedang membela siapapun baik bos maupun pekerja seperti saya ini ini bukan soal membela siapa ini soal kesadaran diri tidak sekali dua kali saya mendapati sesama pekerja menggerutu dan mengeluh soal capeknya bekerja seringkali muncul rencana mau resign mau keluar dan mencari pekerjaan baru yang lebih oke boleh dan saya selalu mendukung siapapun teman maupun saudara untuk maju dan lebih baik namun sebelum ke arah situ tidak ada salahnya kita mencoba untuk berpikir sejenak kalau hanya karena capek pekerjaan mana yang tidak capek kalau hanya karena tekanan pekerjaan mana yang tidak ada tekanan kalau soal salary pekerjaan mana yang bisa langsung kasih salari puluhan juta oke kalaupun memang dibeberapa situasi ada pekerjaanpekerjaan tertentu yang minim tekanan kerja santai gaji besar tetapi perlu kita sadari juga berapa besar ketersediaan pekerjaan yang demikian itu at least kualifikasi apa yang dibutuhkan untuk pekerjaan yang seperti itu tulisan ini berangkat dari narasinarasi yang muncul dari kontenkonten di media sosial intinya soal kita yang bekerja keras bosnya yang kaya raya dan seringkali selalu dikaitkan dengan mental health sebuah konsep kesehatan yang bahkan saya pun tidak terlalu paham ngomongngomong soal kontan mental health dan media sosial disaat yang sama juga muncul narasinarasi yang justri datang dari dimensi perusahaan ini yang menjadi sorotan adalah mengenai etos kerja generasi muda yang dianggap kurang greget selain masalah etos banyak juga soal isu kompetensi,sepahit apapun realitanya membuat kaya raya perusahaan tempat bekerja membuat tetap hidup situlah dapur tetap mengepul anak tetap sekolah istri tetap senyum iuran warga tetap terbayar pulsa tetap terbeli listrik air putus pekerjaan ideal seamanamannya asn senyamannyamannya pegawai bumn seidealidealnya karyawan perusahaan bonafid hingga seenjoyenjoynya freelancer digitalpun tetap punya ketidaknyamanannya sendirisendiri intinya sama bekerja ikut entitas kemampuan lebih besar besar ataupun kecil dimanapun tekanan tetap selalu beda bentuk kalau berpikir bekerja keras bosnya kaya raya artinya dewasa sesederhana anak kecil malas berangkat sekolah lalu bilang ayah sama ibu enak gak sekolah gak pernah mengerjakan pr gak pernah piket kelas persis situasinya sedang membela siapapun baik bos maupun pekerja bukan soal membela siapa soal kesadaran diri sekali kali mendapati sesama pekerja menggerutu mengeluh soal capeknya bekerja seringkali muncul rencana mau resign mau keluar mencari pekerjaan baru lebih oke selalu mendukung siapapun teman maupun saudara maju lebih baik arah situ salahnya mencoba berpikir sejenak kalau capek pekerjaan mana capek kalau tekanan pekerjaan mana tekanan kalau soal salary pekerjaan mana langsung kasih salari puluhan juta oke kalaupun memang dibeberapa situasi pekerjaanpekerjaan tertentu minim tekanan kerja santai gaji besar perlu sadari berapa besar ketersediaan pekerjaan at least kualifikasi apa dibutuhkan pekerjaan tulisan berangkat narasinarasi muncul kontenkonten media sosial intinya soal bekerja keras bosnya kaya raya seringkali selalu dikaitkan mental health sebuah konsep kesehatan bahkan terlalu paham ngomongngomong soal kontan mental health media sosial disaat sama muncul narasinarasi justri datang dimensi perusahaan menjadi sorotan mengenai etos kerja generasi muda dianggap kurang greget masalah etos banyak soal isu kompetensi,pahit apa realitanya buat kaya raya usaha tempat kerja buat tetap hidup situ dapur tetap kepul anak tetap sekolah istri tetap senyum iur warga tetap bayar pulsa tetap beli listrik air putus kerja ideal seamanamannya asn senyamannyamannya pegawai bumn seidealidealnya karyawan usaha bonafid hingga seenjoyenjoynya freelancer digital tetap punya ketidaknyamanannya sendirisendiri inti sama kerja ikut entitas mampu lebih besar besar atau kecil mana tekan tetap selalu beda bentuk kalau pikir kerja keras bos kaya raya arti dewasa sederhana anak kecil malas berangkat sekolah lalu bilang ayah sama ibu enak gak sekolah gak pernah kerja pr gak pernah piket kelas persis situasi sedang bela siapa baik bos maupun kerja bukan soal bela siapa soal sadar diri sekali kali dapat sama kerja gerutu keluh soal capek kerja seringkali muncul rencana mau resign mau keluar cari kerja baru lebih oke selalu dukung siapa teman maupun saudara maju lebih baik arah situ salah coba pikir jenak kalau capek kerja mana capek kalau tekan kerja mana tekan kalau soal salary kerja mana langsung kasih salar puluh juta oke kalaupun memang beberapa situasi pekerjaanpekerjaan tentu minim tekan kerja santai gaji besar perlu sadar berapa besar sedia kerja at least kualifikasi apa butuh kerja tulis berangkat narasinarasi muncul kontenkonten media sosial inti soal kerja keras bos kaya raya seringkali selalu kait mental health buah konsep sehat bahkan terlalu paham ngomongngomong soal kontan mental health media sosial saat sama muncul narasinarasi justri datang dimensi usaha jadi sorot kena etos kerja generasi muda anggap kurang greget masalah etos banyak soal isu kompetensi
https://www.kompasiana.com/deaangela5647/68ff1ce634777c07fe386a52/saat-dunia-terlalu-cepat-peran-resiliensi-dalam-menjaga-keseimbangan-psikologis-generasi-z,"""Saat Dunia Terlalu Cepat : Peran Resiliensi dalam Menjaga Keseimbangan Psikologis Generasi Z""","Dunia kerja saat ini bergerak dalam ritme yang nyaris tanpa jeda. Tuntutan produktivitas, kecepatan adaptasi terhadap teknologi, dan ekspektasi sosial membuat banyak individu terutama Generasi Z harus berpacu lebih cepat. Generasi yang lahir di era digital dikenal kreatif, kritis, dan berorientasi pada hasil, tetapi di sisi lain juga rentan terhadap kelelahan emosional, stres kronis, dan burnout . Generasi Z menghadapi paradoks besar: ambisi yang tinggi, tetapi juga kelelahan yang mendalam. Generasi Z tumbuh dalam tekanan produktivitas tanpa henti, tenggelam dalam budaya hustle, dan terus berlari mengejar ekspektasi diri. Di sinilah resiliensi menjadi lebih dari sekadar kata ""tangguh"", resiliensi adalah seni menyeimbangkan antara kecepatan dan ketenangan, antara stres dan makna.
Penelitian terbaru menunjukkan bahwa modal psikologis (psychological capital) yang terdiri dari optimisme, harapan, efikasi diri, dan resiliensi memiliki pengaruh signifikan terhadap keterikatan kerja pada karyawan Generasi Z (Natalia, Zamralita, & Lie, 2024). Dari keempat dimensi tersebut, resiliensi muncul sebagai faktor paling dominan dalam meningkatkan keterlibatan dan antusiasme individu. Dalam konteks psikologi positif, resiliensi yaitu kemampuan seseorang untuk bangkit, dan beradaptasi secara konstruktif. Tekanan menjadi kunci penting untuk menjaga keseimbangan psikologis di tengah dunia yang serba cepat. Hasil ini mengindikasikan bahwa generasi muda dengan tingkat resiliensi yang tinggi cenderung mampu mengubah tekanan menjadi tantangan yang bermakna, bukan sekadar beban yang melelahkan. Dengan demikian, resiliensi bukan hanya perisai terhadap stres, tetapi juga fondasi bagi keterlibatan dan kinerja optimal.
Fenomena burnout di kalangan Generasi Z semakin menguatkan urgensi pengembangan resiliensi. Dari perspektif teori psikologi positif, resiliensi tidak hanya dimaknai sebagai kemampuan ""bertahan"", tetapi juga sebagai proses adaptasi positif terhadap kesulitan (Luthar & Cicchetti, 2000; Luthar, Crossman, & Small, 2014). Tugade et al. (2004) menekankan bahwa individu yang resilien memiliki fleksibilitas emosional, yaitu kemampuan untuk mengatur emosi dan respons psikologis sesuai tuntutan situasi.

Kekuatan terbesar Generasi Z sebenarnya terletak pada potensi Generasi Z untuk belajar cepat, berpikir kreatif, dan mengintegrasikan nilai -- nilai makna dalam pekerjaan. Ketika Generasi Z memiliki resiliensi yang kuat maka tekanan kerja dapat bertransformasi menjadi energi untuk tumbuh dan berinovasi. Generasi Z mampu memandang tantangan sebagai bagian dari proses belajar, bukan sebagai ancaman terhadap kesejahteraan diri. Sebaliknya, tanpa resiliensi, tantangan yang terus -- menerus dapat berubah menjadi beban mental yang mengikis motivasi, mempercepat burnout , dan mendorong keputusan untuk berpindah kerja. Burnout yang tidak dikelola dengan baik pada akhirnya bukan hanya mengganggu kesejahteraan individu, tetapi juga menurunkan produktivitas organisasi secara keseluruhan (Maslach & Leiter, 1997). Di tengah dunia yang terlalu cepat dan penuh tekanan, resiliensi menjadi pondasi keseimbangan psikologis bagi Generasi Z. Ketika Generasi Z mampu mengelola emosi, menemukan makna, dan beradaptasi secara positif, burnout bukan lagi akhir dari produktivitas melainkan sinyal untuk bertransformasi. Dengan dukungan organisasi dan kesadaran individu, Generasi Z dapat menjadi generasi yang tidak hanya tangguh menghadapi perubahan, tetapi juga berkembang melaluinya.

DAFTAR PUSTAKA
Calista, T. J., & Nugrahaningsih, T. H. (2023). Peran mediasi eustress pada pengaruh resiliensi terhadap work engagement pada karyawan generasi Y dan Z. Jurnal E-Bis, 16(2), 142--153.
Lubis, R., Syafitri, N., Maylinda, R. N., et al. (2024). Job stress and turnover intention in generation Z teachers: Resilience as a moderator. Psikologika, 29(1), 95--107.
Luthar, S. S., & Cicchetti, D. (2000). The construct of resilience: Implications for interventions and social policy. Development and Psychopathology, 12(4), 857--885.

Luthar, S. S., Crossman, E. J., & Small, P. J. (2014). Resilience and adversity. In M. Lewis & K. Rudolph (Eds.), Handbook of Developmental Psychopathology (3rd ed.). Springer.

Maslach, C., & Leiter, M. P. (1997). The truth about burnout: How organizations cause personal stress and what to do about it. Jossey-Bass.
Natalia, F., Zamralita, & Lie, D. (2024). Pengaruh modal psikologis terhadap keterikatan kerja pada karyawan generasi Z . Jurnal Serina Sosial Humaniora, 11(1), 60--71.",,dunia kerja saat ini bergerak dalam ritme yang nyaris tanpa jeda tuntutan produktivitas kecepatan adaptasi terhadap teknologi dan ekspektasi sosial membuat banyak individu terutama generasi z harus berpacu lebih cepat generasi yang lahir di era digital dikenal kreatif kritis dan berorientasi pada hasil tetapi di sisi lain juga rentan terhadap kelelahan emosional stres kronis dan burnout  generasi z menghadapi paradoks besar ambisi yang tinggi tetapi juga kelelahan yang mendalam generasi z tumbuh dalam tekanan produktivitas tanpa henti tenggelam dalam budaya hustle dan terus berlari mengejar ekspektasi diri di sinilah resiliensi menjadi lebih dari sekadar kata tangguh resiliensi adalah seni menyeimbangkan antara kecepatan dan ketenangan antara stres dan makna penelitian terbaru menunjukkan bahwa modal psikologis psychological capital yang terdiri dari optimisme harapan efikasi diri dan resiliensi memiliki pengaruh signifikan terhadap keterikatan kerja pada karyawan generasi z natalia zamralita  lie  dari keempat dimensi tersebut resiliensi muncul sebagai faktor paling dominan dalam meningkatkan keterlibatan dan antusiasme individu dalam konteks psikologi positif resiliensi yaitu kemampuan seseorang untuk bangkit dan beradaptasi secara konstruktif tekanan menjadi kunci penting untuk menjaga keseimbangan psikologis di tengah dunia yang serba cepat hasil ini mengindikasikan bahwa generasi muda dengan tingkat resiliensi yang tinggi cenderung mampu mengubah tekanan menjadi tantangan yang bermakna bukan sekadar beban yang melelahkan dengan demikian resiliensi bukan hanya perisai terhadap stres tetapi juga fondasi bagi keterlibatan dan kinerja optimal fenomena burnout di kalangan generasi z semakin menguatkan urgensi pengembangan resiliensi dari perspektif teori psikologi positif resiliensi tidak hanya dimaknai sebagai kemampuan bertahan tetapi juga sebagai proses adaptasi positif terhadap kesulitan luthar  cicchetti  luthar crossman  small  tugade et al  menekankan bahwa individu yang resilien memiliki fleksibilitas emosional yaitu kemampuan untuk mengatur emosi dan respons psikologis sesuai tuntutan situasi kekuatan terbesar generasi z sebenarnya terletak pada potensi generasi z untuk belajar cepat berpikir kreatif dan mengintegrasikan nilai  nilai makna dalam pekerjaan ketika generasi z memiliki resiliensi yang kuat maka tekanan kerja dapat bertransformasi menjadi energi untuk tumbuh dan berinovasi generasi z mampu memandang tantangan sebagai bagian dari proses belajar bukan sebagai ancaman terhadap kesejahteraan diri sebaliknya tanpa resiliensi tantangan yang terus  menerus dapat berubah menjadi beban mental yang mengikis motivasi mempercepat burnout  dan mendorong keputusan untuk berpindah kerja burnout yang tidak dikelola dengan baik pada akhirnya bukan hanya mengganggu kesejahteraan individu tetapi juga menurunkan produktivitas organisasi secara keseluruhan maslach  leiter  di tengah dunia yang terlalu cepat dan penuh tekanan resiliensi menjadi pondasi keseimbangan psikologis bagi generasi z ketika generasi z mampu mengelola emosi menemukan makna dan beradaptasi secara positif burnout bukan lagi akhir dari produktivitas melainkan sinyal untuk bertransformasi dengan dukungan organisasi dan kesadaran individu generasi z dapat menjadi generasi yang tidak hanya tangguh menghadapi perubahan tetapi juga berkembang melaluinya daftar pustaka calista t j  nugrahaningsih t h  peran mediasi eustress pada pengaruh resiliensi terhadap work engagement pada karyawan generasi y dan z jurnal ebis   lubis r syafitri n maylinda r n et al  job stress and turnover intention in generation z teachers resilience as a moderator psikologika   luthar s s  cicchetti d  the construct of resilience implications for interventions and social policy development and psychopathology   luthar s s crossman e j  small p j  resilience and adversity in m lewis  k rudolph eds handbook of developmental psychopathology rd ed springer maslach c  leiter m p  the truth about burnout how organizations cause personal stress and what to do about it josseybass natalia f zamralita  lie d  pengaruh modal psikologis terhadap keterikatan kerja pada karyawan generasi z  jurnal serina sosial humaniora,dunia kerja bergerak ritme nyaris jeda tuntutan produktivitas kecepatan adaptasi teknologi ekspektasi sosial membuat banyak individu terutama generasi z berpacu lebih cepat generasi lahir era digital dikenal kreatif kritis berorientasi hasil sisi rentan kelelahan emosional stres kronis burnout generasi z menghadapi paradoks besar ambisi tinggi kelelahan mendalam generasi z tumbuh tekanan produktivitas henti tenggelam budaya hustle terus berlari mengejar ekspektasi diri sinilah resiliensi menjadi lebih sekadar kata tangguh resiliensi seni menyeimbangkan kecepatan ketenangan stres makna penelitian terbaru menunjukkan modal psikologis psychological capital terdiri optimisme harapan efikasi diri resiliensi memiliki pengaruh signifikan keterikatan kerja karyawan generasi z natalia zamralita lie keempat dimensi tersebut resiliensi muncul faktor paling dominan meningkatkan keterlibatan antusiasme individu konteks psikologi positif resiliensi kemampuan seseorang bangkit beradaptasi konstruktif tekanan menjadi kunci penting menjaga keseimbangan psikologis tengah dunia serba cepat hasil mengindikasikan generasi muda tingkat resiliensi tinggi cenderung mampu mengubah tekanan menjadi tantangan bermakna bukan sekadar beban melelahkan resiliensi bukan perisai stres fondasi keterlibatan kinerja optimal fenomena burnout kalangan generasi z semakin menguatkan urgensi pengembangan resiliensi perspektif teori psikologi positif resiliensi dimaknai kemampuan bertahan proses adaptasi positif kesulitan luthar cicchetti luthar crossman small tugade et al menekankan individu resilien memiliki fleksibilitas emosional kemampuan mengatur emosi respons psikologis sesuai tuntutan situasi kekuatan terbesar generasi z sebenarnya terletak potensi generasi z belajar cepat berpikir kreatif mengintegrasikan nilai nilai makna pekerjaan generasi z memiliki resiliensi kuat tekanan kerja bertransformasi menjadi energi tumbuh berinovasi generasi z mampu memandang tantangan bagian proses belajar bukan ancaman kesejahteraan diri sebaliknya resiliensi tantangan terus menerus berubah menjadi beban mental mengikis motivasi mempercepat burnout mendorong keputusan berpindah kerja burnout dikelola baik akhirnya bukan mengganggu kesejahteraan individu menurunkan produktivitas organisasi keseluruhan maslach leiter tengah dunia terlalu cepat penuh tekanan resiliensi menjadi pondasi keseimbangan psikologis generasi z generasi z mampu mengelola emosi menemukan makna beradaptasi positif burnout bukan akhir produktivitas sinyal bertransformasi dukungan organisasi kesadaran individu generasi z menjadi generasi tangguh menghadapi perubahan berkembang melaluinya daftar pustaka calista t j nugrahaningsih t h peran mediasi eustress pengaruh resiliensi work engagement karyawan generasi y z jurnal ebis lubis r syafitri n maylinda r n et al job stress and turnover intention in generation z teachers resilience as a moderator psikologika luthar s s cicchetti d the construct of resilience implications for interventions and social policy development and psychopathology luthar s s crossman e j small p j resilience and adversity in m lewis k rudolph eds handbook of developmental psychopathology rd ed springer maslach c leiter m p the truth about burnout how organizations cause personal stress and what to do about it josseybass natalia f zamralita lie d pengaruh modal psikologis keterikatan kerja karyawan generasi z jurnal serina sosial humaniora,dunia kerja gerak ritme nyaris jeda tuntut produktivitas cepat adaptasi teknologi ekspektasi sosial buat banyak individu utama generasi z pacu lebih cepat generasi lahir era digital kenal kreatif kritis orientasi hasil sisi rentan lelah emosional stres kronis burnout generasi z hadap paradoks besar ambisi tinggi lelah dalam generasi z tumbuh tekan produktivitas henti tenggelam budaya hustle terus lari kejar ekspektasi diri sini resiliensi jadi lebih sekadar kata tangguh resiliensi seni imbang cepat tenang stres makna teliti baru tunjuk modal psikologis psychological capital diri optimisme harap efikasi diri resiliensi milik pengaruh signifikan ikat kerja karyawan generasi z natalia zamralita lie empat dimensi sebut resiliensi muncul faktor paling dominan tingkat libat antusiasme individu konteks psikologi positif resiliensi mampu orang bangkit adaptasi konstruktif tekan jadi kunci penting jaga imbang psikologis tengah dunia serba cepat hasil indikasi generasi muda tingkat resiliensi tinggi cenderung mampu ubah tekan jadi tantang makna bukan sekadar beban lelah resiliensi bukan perisai stres fondasi libat kerja optimal fenomena burnout kalang generasi z makin kuat urgensi kembang resiliensi perspektif teori psikologi positif resiliensi makna mampu tahan proses adaptasi positif sulit luthar cicchetti luthar crossman small tugade et al tekan individu resilien milik fleksibilitas emosional mampu atur emosi respons psikologis sesuai tuntut situasi kuat besar generasi z benar letak potensi generasi z ajar cepat pikir kreatif integrasi nilai nilai makna kerja generasi z milik resiliensi kuat tekan kerja transformasi jadi energi tumbuh inovasi generasi z mampu pandang tantang bagi proses ajar bukan ancam sejahtera diri balik resiliensi tantang terus terus ubah jadi beban mental kikis motivasi cepat burnout dorong putus pindah kerja burnout kelola baik akhir bukan ganggu sejahtera individu turun produktivitas organisasi seluruh maslach leiter tengah dunia terlalu cepat penuh tekan resiliensi jadi pondasi imbang psikologis generasi z generasi z mampu kelola emosi temu makna adaptasi positif burnout bukan akhir produktivitas sinyal transformasi dukung organisasi sadar individu generasi z jadi generasi tangguh hadap ubah kembang lalu daftar pustaka calista t j nugrahaningsih t h peran mediasi eustress pengaruh resiliensi work engagement karyawan generasi y z jurnal ebis lubis r syafitri n maylinda r n et al job stress and turnover intention in generation z teachers resilience as a moderator psikologika luthar s s cicchetti d the construct of resilience implications for interventions and social policy development and psychopathology luthar s s crossman e j small p j resilience and adversity in m lewis k rudolph eds handbook of developmental psychopathology rd ed springer maslach c leiter m p the truth about burnout how organizations cause personal stress and what to do about it josseybass natalia f zamralita lie d pengaruh modal psikologis ikat kerja karyawan generasi z jurnal serina sosial humaniora
