url,title,body,date,body_clean,body_nostop,body_stemmed
https://www.kompasiana.com/mariatanjungsari9739/690c110634777c0ff643a154/usia-bukan-penghalang-untuk-upgrade-beragam-skill,Usia Bukan Penghalang Untuk Upgrade Beragam Skill,"
Menjadi seorang perempuan dengan usia yang tidak muda lagi bukan berarti jadi penghalang untuk terus berkarya. Produktif dan terus berkarya tidak identik hanya untuk pekerja kantoran saja kok. Kalian yang kebetulan baru saja resign dari pekerjaan kantoran dan memutuskan untuk jadi ibu rumah tangga atau mungkin menjadi caregiver lansia , bisa tetap produktif meskipun hanya dari rumah.
Sebenarnya saya sedih juga ketika melihat kenyataan ada beberapa lowongan kerja dimana salah satu syarat untuk menjadi karyawan adalah batas usia maksimum tidak boleh melebihi 35 tahun.

Padahal pencari kerja berusia 40 tahun ke atas itu masih dikatakan produktif selama sehat jasmani dan rohani. Namun bagaimana lagi, fenomena itulah yang terjadi saat ini dalam dunia kerja di negara kita. Meskipun sudah ada Surat Edaran (SE) Menteri Ketenagakerjaan Nomor M/6/HK.04/V/2025 tentang Larangan Diskriminasi dalam Proses Rekrutmen Tenaga Kerja yang dikeluarkan pada 28 Mei 2025 namun tentu semua kembali lagi dengan kebijakan masing-masing perusahaan.

Jika usia menjadi penghalang bagimu dalam mencari kerja, maka marilah kita coba untuk mencari solusi dengan berupaya menciptakan peluang kerja bagi diri sendiri. Mungkin awalnya tidak mudah, namun lama kelamaan jika kita ulet dan mau berusaha maka yakinlah, Insha Allah peluang pasti ada.
Salah satu cara untuk bisa membuka peluang pekerjaan bagi diri sendiri adalah dengan upgrade diri . Upgrade diri dalam hal ini dapat kita lakukan dengan beberapa cara, misalnya saja:
1. Tingkatkan skills baik itu hard skills maupun soft skills .
2. Membuka networking positif seluas-seluasnya dengan bergabung di komunitas sesuai minatmu

3. Perluas wawasan dengan membaca buku-buku yang bermanfaat

Dengan upgrade diri, maka pengetahuanmu bisa jadi lebih banyak dibanding karyawan kantoran yang mungkin hanya fokus di beberapa bidang pekerjaan saja.
Oleh sebab itu tidak perlu minder ketika menjadi seorang perempuan dengan status ibu rumah tangga yang mungkin menghabiskan 80% waktunya di rumah saja. Namun tak ada yang tahu bukan, jika di dalam rumah pun kita melakukan pekerjaan produktif seperti menulis, desain gambar, membuat e-book dan masih banyak lagi karya-karya lainnya. Mau Upgrade Diri , Pikirkan Mulai Dari Mana Terlebih Dahulu",,menjadi seorang perempuan dengan usia yang tidak muda lagi bukan berarti jadi penghalang untuk terus berkarya produktif dan terus berkarya tidak identik hanya untuk pekerja kantoran saja kok kalian yang kebetulan baru saja resign dari pekerjaan kantoran dan memutuskan untuk jadi ibu rumah tangga atau mungkin menjadi caregiver lansia  bisa tetap produktif meskipun hanya dari rumah sebenarnya saya sedih juga ketika melihat kenyataan ada beberapa lowongan kerja dimana salah satu syarat untuk menjadi karyawan adalah batas usia maksimum tidak boleh melebihi  tahun padahal pencari kerja berusia  tahun ke atas itu masih dikatakan produktif selama sehat jasmani dan rohani namun bagaimana lagi fenomena itulah yang terjadi saat ini dalam dunia kerja di negara kita meskipun sudah ada surat edaran se menteri ketenagakerjaan nomor mhkv tentang larangan diskriminasi dalam proses rekrutmen tenaga kerja yang dikeluarkan pada  mei  namun tentu semua kembali lagi dengan kebijakan masingmasing perusahaan jika usia menjadi penghalang bagimu dalam mencari kerja maka marilah kita coba untuk mencari solusi dengan berupaya menciptakan peluang kerja bagi diri sendiri mungkin awalnya tidak mudah namun lama kelamaan jika kita ulet dan mau berusaha maka yakinlah insha allah peluang pasti ada salah satu cara untuk bisa membuka peluang pekerjaan bagi diri sendiri adalah dengan upgrade diri  upgrade diri dalam hal ini dapat kita lakukan dengan beberapa cara misalnya saja  tingkatkan skills baik itu hard skills maupun soft skills   membuka networking positif seluasseluasnya dengan bergabung di komunitas sesuai minatmu  perluas wawasan dengan membaca bukubuku yang bermanfaat dengan upgrade diri maka pengetahuanmu bisa jadi lebih banyak dibanding karyawan kantoran yang mungkin hanya fokus di beberapa bidang pekerjaan saja oleh sebab itu tidak perlu minder ketika menjadi seorang perempuan dengan status ibu rumah tangga yang mungkin menghabiskan  waktunya di rumah saja namun tak ada yang tahu bukan jika di dalam rumah pun kita melakukan pekerjaan produktif seperti menulis desain gambar membuat ebook dan masih banyak lagi karyakarya lainnya mau upgrade diri  pikirkan mulai dari mana terlebih dahulu,menjadi seorang perempuan usia muda bukan berarti jadi penghalang terus berkarya produktif terus berkarya identik pekerja kantoran kok kalian kebetulan baru resign pekerjaan kantoran memutuskan jadi ibu rumah tangga mungkin menjadi caregiver lansia tetap produktif meskipun rumah sebenarnya sedih melihat kenyataan beberapa lowongan kerja salah satu syarat menjadi karyawan batas usia maksimum melebihi tahun padahal pencari kerja berusia tahun atas dikatakan produktif selama sehat jasmani rohani bagaimana fenomena terjadi dunia kerja negara meskipun surat edaran se menteri ketenagakerjaan nomor mhkv larangan diskriminasi proses rekrutmen tenaga kerja dikeluarkan mei semua kebijakan masingmasing perusahaan usia menjadi penghalang bagimu mencari kerja marilah coba mencari solusi berupaya menciptakan peluang kerja diri sendiri mungkin awalnya mudah lama kelamaan ulet mau berusaha yakinlah insha allah peluang salah satu cara membuka peluang pekerjaan diri sendiri upgrade diri upgrade diri lakukan beberapa cara misalnya tingkatkan skills baik hard skills maupun soft skills membuka networking positif seluasseluasnya bergabung komunitas sesuai minatmu perluas wawasan membaca bukubuku bermanfaat upgrade diri pengetahuanmu jadi lebih banyak dibanding karyawan kantoran mungkin fokus beberapa bidang pekerjaan perlu minder menjadi seorang perempuan status ibu rumah tangga mungkin menghabiskan waktunya rumah tak tahu bukan rumah melakukan pekerjaan produktif menulis desain gambar membuat ebook banyak karyakarya lainnya mau upgrade diri pikirkan mulai mana terlebih,jadi orang perempuan usia muda bukan arti jadi halang terus karya produktif terus karya identik kerja kantor kok kalian betul baru resign kerja kantor putus jadi ibu rumah tangga mungkin jadi caregiver lansia tetap produktif meski rumah benar sedih lihat nyata beberapa lowong kerja salah satu syarat jadi karyawan batas usia maksimum lebih tahun padahal cari kerja usia tahun atas kata produktif lama sehat jasmani rohani bagaimana fenomena jadi dunia kerja negara meski surat edar se menteri ketenagakerjaan nomor mhkv larang diskriminasi proses rekrutmen tenaga kerja keluar mei semua bijak masingmasing usaha usia jadi halang bagi cari kerja mari coba cari solusi upaya cipta peluang kerja diri sendiri mungkin awal mudah lama lama ulet mau usaha yakin insha allah peluang salah satu cara buka peluang kerja diri sendiri upgrade diri upgrade diri laku beberapa cara misal tingkat skills baik hard skills maupun soft skills buka networking positif seluasseluasnya gabung komunitas sesuai minat luas wawas baca bukubuku manfaat upgrade diri tahu jadi lebih banyak banding karyawan kantor mungkin fokus beberapa bidang kerja perlu minder jadi orang perempuan status ibu rumah tangga mungkin habis waktu rumah tak tahu bukan rumah laku kerja produktif tulis desain gambar buat ebook banyak karyakarya lain mau upgrade diri pikir mulai mana lebih
https://www.kompasiana.com/krisanti91370/6901baafed641513b846fe24/menghadapi-sugar-coating-seni-iyaian-aja-di-dunia-kerja,"Seni ""Iyain Aja"" Menghadapi Sugar Coating di Dunia Kerja","
Di dunia kerja , kadang kata ""setuju"" bukan berarti benar-benar setuju, dan kalimat ""nanti kita bahas lagi"" bisa jadi isyarat halus bahwa topik itu tidak akan pernah dibahas. Semua terdengar sopan, manis, dan aman, sampai akhirnya kita sadar, tidak semua kata di kantor punya arti yang sebenarnya.
Dalam ruang kerja yang katanya profesional, sering kali kita justru menghadapi dinamika sosial yang penuh rasa: ada yang sugar coating biar suasana tetap adem, ada yang bicara diplomatis demi menjaga citra, dan ada pula yang menebar pujian seperti gula pasir, banyak, tapi tak semua tulus.

Di tengah ""politik halus"" semacam itu, bertahan kadang bukan soal siapa paling pintar berdebat, tapi siapa yang paling bijak mengelola reaksi. Dan dari situlah lahir satu seni bertahan yang tak tertulis di buku manapun: jurus "" iyain aja "" bukan karena tak punya pendapat, tapi karena tahu kapan harus bicara, dan kapan cukup tersenyum sambil berkata, ""Oh, iya ya, bener juga."" Rekan Kerja dan Gaya Sugar Coating

Dalam dunia kerja, kita pasti pernah bertemu dengan tipe rekan yang selalu terdengar positif banget. Mereka ahli memilih kata, tahu kapan harus memuji, dan mahir mengubah kritik menjadi kalimat manis yang terdengar seperti lagu pop mellow, enak di telinga, tapi kadang bikin bingung apa maksud sebenarnya.
Misalnya, saat proyekmu masih berantakan, mereka bilang, ""Wah, idemu keren banget! Cuma mungkin perlu sedikit penyempurnaan di hampir semua bagian.""
Atau ketika rapat berakhir tanpa keputusan, seseorang dengan santai berkata, ""Yang penting kita sudah punya arah."" Arah ke mana? Entahlah.
Fenomena ini dikenal sebagai sugar coating , membungkus kebenaran dengan kata-kata manis agar tidak menyinggung siapa pun. Dalam budaya kerja yang menjunjung ""kerukunan dan sopan santun"", gaya seperti ini memang terasa aman. Tidak menimbulkan gesekan, tidak bikin suasana panas. Tapi lama-lama, kalau kebanyakan gula, malah bikin kita kehilangan rasa asli dari masalah yang perlu diselesaikan.

Yang menarik, sugar coating ini bukan selalu niat buruk. Kadang justru lahir dari niat baik: ingin menjaga perasaan rekan kerja, menghindari konflik, atau sekadar lelah menghadapi drama kantor yang tak kunjung usai. Namun di sisi lain, kalau dibiarkan, budaya manis-manisan ini bisa menumpulkan kejujuran dan mengaburkan arah kerja tim.

Dan di titik itulah, jurus ""iyain aja"" sering muncul bukan sebagai bentuk menyerah, tapi sebagai mekanisme pertahanan diri. Sebuah cara elegan untuk tetap waras di tengah kalimat manis yang tak selalu bermakna.
Ilustrasi sugar coating | Sumber: mumbelievable.com Jurus "" Iyain Aja "": Antara Strategi Bertahan dan Diplomasi Emosional",,di dunia kerja  kadang kata setuju bukan berarti benarbenar setuju dan kalimat nanti kita bahas lagi bisa jadi isyarat halus bahwa topik itu tidak akan pernah dibahas semua terdengar sopan manis dan aman sampai akhirnya kita sadar tidak semua kata di kantor punya arti yang sebenarnya dalam ruang kerja yang katanya profesional sering kali kita justru menghadapi dinamika sosial yang penuh rasa ada yang sugar coating biar suasana tetap adem ada yang bicara diplomatis demi menjaga citra dan ada pula yang menebar pujian seperti gula pasir banyak tapi tak semua tulus di tengah politik halus semacam itu bertahan kadang bukan soal siapa paling pintar berdebat tapi siapa yang paling bijak mengelola reaksi dan dari situlah lahir satu seni bertahan yang tak tertulis di buku manapun jurus  iyain aja  bukan karena tak punya pendapat tapi karena tahu kapan harus bicara dan kapan cukup tersenyum sambil berkata oh iya ya bener juga rekan kerja dan gaya sugar coating dalam dunia kerja kita pasti pernah bertemu dengan tipe rekan yang selalu terdengar positif banget mereka ahli memilih kata tahu kapan harus memuji dan mahir mengubah kritik menjadi kalimat manis yang terdengar seperti lagu pop mellow enak di telinga tapi kadang bikin bingung apa maksud sebenarnya misalnya saat proyekmu masih berantakan mereka bilang wah idemu keren banget cuma mungkin perlu sedikit penyempurnaan di hampir semua bagian atau ketika rapat berakhir tanpa keputusan seseorang dengan santai berkata yang penting kita sudah punya arah arah ke mana entahlah fenomena ini dikenal sebagai sugar coating  membungkus kebenaran dengan katakata manis agar tidak menyinggung siapa pun dalam budaya kerja yang menjunjung kerukunan dan sopan santun gaya seperti ini memang terasa aman tidak menimbulkan gesekan tidak bikin suasana panas tapi lamalama kalau kebanyakan gula malah bikin kita kehilangan rasa asli dari masalah yang perlu diselesaikan yang menarik sugar coating ini bukan selalu niat buruk kadang justru lahir dari niat baik ingin menjaga perasaan rekan kerja menghindari konflik atau sekadar lelah menghadapi drama kantor yang tak kunjung usai namun di sisi lain kalau dibiarkan budaya manismanisan ini bisa menumpulkan kejujuran dan mengaburkan arah kerja tim dan di titik itulah jurus iyain aja sering muncul bukan sebagai bentuk menyerah tapi sebagai mekanisme pertahanan diri sebuah cara elegan untuk tetap waras di tengah kalimat manis yang tak selalu bermakna ilustrasi sugar coating  sumber mumbelievablecom jurus  iyain aja  antara strategi bertahan dan diplomasi emosional,dunia kerja kadang kata setuju bukan berarti benarbenar setuju kalimat bahas jadi isyarat halus topik pernah dibahas semua terdengar sopan manis aman akhirnya sadar semua kata kantor punya arti sebenarnya ruang kerja katanya profesional sering kali justru menghadapi dinamika sosial penuh rasa sugar coating biar suasana tetap adem bicara diplomatis menjaga citra menebar pujian gula pasir banyak tak semua tulus tengah politik halus semacam bertahan kadang bukan soal siapa paling pintar berdebat siapa paling bijak mengelola reaksi situlah lahir satu seni bertahan tak tertulis buku manapun jurus iyain aja bukan tak punya pendapat tahu kapan bicara kapan cukup tersenyum berkata iya bener rekan kerja gaya sugar coating dunia kerja pernah bertemu tipe rekan selalu terdengar positif banget ahli memilih kata tahu kapan memuji mahir mengubah kritik menjadi kalimat manis terdengar lagu pop mellow enak telinga kadang bikin bingung apa maksud sebenarnya misalnya proyekmu berantakan bilang wah idemu keren banget cuma mungkin perlu sedikit penyempurnaan hampir semua bagian rapat berakhir keputusan seseorang santai berkata penting punya arah arah mana entahlah fenomena dikenal sugar coating membungkus kebenaran katakata manis menyinggung siapa budaya kerja menjunjung kerukunan sopan santun gaya memang terasa aman menimbulkan gesekan bikin suasana panas lamalama kalau kebanyakan gula malah bikin kehilangan rasa asli masalah perlu diselesaikan menarik sugar coating bukan selalu niat buruk kadang justru lahir niat baik menjaga perasaan rekan kerja menghindari konflik sekadar lelah menghadapi drama kantor tak kunjung usai sisi kalau dibiarkan budaya manismanisan menumpulkan kejujuran mengaburkan arah kerja tim titik jurus iyain aja sering muncul bukan bentuk menyerah mekanisme pertahanan diri sebuah cara elegan tetap waras tengah kalimat manis tak selalu bermakna ilustrasi sugar coating sumber mumbelievablecom jurus iyain aja strategi bertahan diplomasi emosional,dunia kerja kadang kata tuju bukan arti benarbenar tuju kalimat bahas jadi isyarat halus topik pernah bahas semua dengar sopan manis aman akhir sadar semua kata kantor punya arti benar ruang kerja kata profesional sering kali justru hadap dinamika sosial penuh rasa sugar coating biar suasana tetap adem bicara diplomatis jaga citra tebar puji gula pasir banyak tak semua tulus tengah politik halus macam tahan kadang bukan soal siapa paling pintar debat siapa paling bijak kelola reaksi situ lahir satu seni tahan tak tulis buku mana jurus iyain aja bukan tak punya dapat tahu kapan bicara kapan cukup senyum kata iya bener rekan kerja gaya sugar coating dunia kerja pernah temu tipe rekan selalu dengar positif banget ahli pilih kata tahu kapan puji mahir ubah kritik jadi kalimat manis dengar lagu pop mellow enak telinga kadang bikin bingung apa maksud benar misal proyek beranta bilang wah ide keren banget cuma mungkin perlu sedikit sempurna hampir semua bagi rapat akhir putus orang santai kata penting punya arah arah mana entah fenomena kenal sugar coating bungkus benar katakata manis singgung siapa budaya kerja junjung rukun sopan santun gaya memang asa aman timbul gesek bikin suasana panas lamalama kalau banyak gula malah bikin hilang rasa asli masalah perlu selesai tarik sugar coating bukan selalu niat buruk kadang justru lahir niat baik jaga asa rekan kerja hindar konflik sekadar lelah hadap drama kantor tak kunjung usai sisi kalau biar budaya manismanisan tumpul jujur abur arah kerja tim titik jurus iyain aja sering muncul bukan bentuk serah mekanisme tahan diri buah cara elegan tetap waras tengah kalimat manis tak selalu makna ilustrasi sugar coating sumber mumbelievablecom jurus iyain aja strategi tahan diplomasi emosional
https://www.kompasiana.com/newsums3898/69157662c925c467b77e2782/ums-terima-kunjungan-studi-tiru-um-palopo-terkait-pusar-karir-dan-alumni,UMS Terima Kunjungan Studi Tiru UM Palopo Terkait Pusar Karir dan Alumni,"SURAKARTA -- Universitas Muhammadiyah Palopo ( UM Palopo ) melakukan kunjungan studi tiru ke Universitas Muhammadiyah Surakarta (UMS) pada Senin, 3 November 2025. Kegiatan yang berlangsung di Ruang Sidang Rektorat, Gedung Induk Siti Walidah UMS ini berfokus pada pengelolaan Pusat Karir dan Hubungan Alumni (PKHA).
Kunjungan tersebut disambut langsung oleh Wakil Rektor III UMS, didampingi oleh Kepala Lembaga Pengembangan Persyarikatan, Pengkaderan, dan Alumni (LP3A), serta Pimpinan Pusat Karir dan Hubungan Alumni UMS beserta jajarannya.


Dalam kesempatan tersebut, rombongan UM Palopo berdiskusi dan berbagi pengalaman mengenai berbagai program strategis yang dijalankan UMS, seperti pengembangan pusat karir, pelacakan lulusan (tracer study), serta kegiatan pembinaan karir dan penguatan jaringan alumni.

Wakil Rektor III UMS, Dr. Mutohharun Jinan, M.Ag., dalam sambutannya menyampaikan apresiasi atas kunjungan tersebut dan menegaskan pentingnya kolaborasi antarperguruan tinggi Muhammadiyah dalam peningkatan mutu layanan karir mahasiswa dan alumni.
""Melalui kegiatan studi tiru seperti ini, kita dapat saling belajar dan memperkuat sinergi dalam membangun sistem pembinaan karir yang berkelanjutan bagi mahasiswa dan alumni,"" ujar Dr. Mutohharun Jinan, Rabu (5/11).
(tengah) Wakil Rektor III UMS, Dr. Mutohharun Jinan, M.Ag (sumber : Humas UMS)
Kunjungan ini diharapkan dapat mempererat kerja sama yang berkelanjutan antara UMS dan UM Palopo dalam pengembangan program pusat karir dan hubungan alumni yang inovatif serta berorientasi pada kebutuhan dunia kerja .

Foto bersama (sumber : Humas UMS) Sementara itu, perwakilan UM Palopo, Dr. Abdul Kadis, M.Psi., Cas. psy., menyampaikan bahwa kegiatan ini merupakan bagian dari upaya penguatan lembaga pusat karir di lingkungan UM Palopo agar mampu memberikan layanan yang lebih efektif dalam mendukung kesiapan kerja lulusan serta membangun jejaring alumni yang solid.

Kegiatan studi tiru yang digelar pada Senin (3/11) itu diakhiri dengan sesi tanya jawab, pertukaran cenderamata, serta peninjauan langsung ke ruang kerja Pusat Karir dan Hubungan Alumni UMS.
(Fika/Humas UMS)",,surakarta  universitas muhammadiyah palopo  um palopo  melakukan kunjungan studi tiru ke universitas muhammadiyah surakarta ums pada senin  november  kegiatan yang berlangsung di ruang sidang rektorat gedung induk siti walidah ums ini berfokus pada pengelolaan pusat karir dan hubungan alumni pkha kunjungan tersebut disambut langsung oleh wakil rektor iii ums didampingi oleh kepala lembaga pengembangan persyarikatan pengkaderan dan alumni lpa serta pimpinan pusat karir dan hubungan alumni ums beserta jajarannya dalam kesempatan tersebut rombongan um palopo berdiskusi dan berbagi pengalaman mengenai berbagai program strategis yang dijalankan ums seperti pengembangan pusat karir pelacakan lulusan tracer study serta kegiatan pembinaan karir dan penguatan jaringan alumni wakil rektor iii ums dr mutohharun jinan mag dalam sambutannya menyampaikan apresiasi atas kunjungan tersebut dan menegaskan pentingnya kolaborasi antarperguruan tinggi muhammadiyah dalam peningkatan mutu layanan karir mahasiswa dan alumni melalui kegiatan studi tiru seperti ini kita dapat saling belajar dan memperkuat sinergi dalam membangun sistem pembinaan karir yang berkelanjutan bagi mahasiswa dan alumni ujar dr mutohharun jinan rabu  tengah wakil rektor iii ums dr mutohharun jinan mag sumber  humas ums kunjungan ini diharapkan dapat mempererat kerja sama yang berkelanjutan antara ums dan um palopo dalam pengembangan program pusat karir dan hubungan alumni yang inovatif serta berorientasi pada kebutuhan dunia kerja  foto bersama sumber  humas ums sementara itu perwakilan um palopo dr abdul kadis mpsi cas psy menyampaikan bahwa kegiatan ini merupakan bagian dari upaya penguatan lembaga pusat karir di lingkungan um palopo agar mampu memberikan layanan yang lebih efektif dalam mendukung kesiapan kerja lulusan serta membangun jejaring alumni yang solid kegiatan studi tiru yang digelar pada senin  itu diakhiri dengan sesi tanya jawab pertukaran cenderamata serta peninjauan langsung ke ruang kerja pusat karir dan hubungan alumni ums fikahumas ums,surakarta universitas muhammadiyah palopo um palopo melakukan kunjungan studi tiru universitas muhammadiyah surakarta ums senin november kegiatan berlangsung ruang sidang rektorat gedung induk siti walidah ums berfokus pengelolaan pusat karir hubungan alumni pkha kunjungan tersebut disambut langsung wakil rektor iii ums didampingi kepala lembaga pengembangan persyarikatan pengkaderan alumni lpa pimpinan pusat karir hubungan alumni ums beserta jajarannya kesempatan tersebut rombongan um palopo berdiskusi berbagi pengalaman mengenai berbagai program strategis dijalankan ums pengembangan pusat karir pelacakan lulusan tracer study kegiatan pembinaan karir penguatan jaringan alumni wakil rektor iii ums dr mutohharun jinan mag sambutannya menyampaikan apresiasi atas kunjungan tersebut menegaskan pentingnya kolaborasi antarperguruan tinggi muhammadiyah peningkatan mutu layanan karir mahasiswa alumni melalui kegiatan studi tiru saling belajar memperkuat sinergi membangun sistem pembinaan karir berkelanjutan mahasiswa alumni ujar dr mutohharun jinan rabu tengah wakil rektor iii ums dr mutohharun jinan mag sumber humas ums kunjungan diharapkan mempererat kerja sama berkelanjutan ums um palopo pengembangan program pusat karir hubungan alumni inovatif berorientasi kebutuhan dunia kerja foto bersama sumber humas ums perwakilan um palopo dr abdul kadis mpsi cas psy menyampaikan kegiatan merupakan bagian upaya penguatan lembaga pusat karir lingkungan um palopo mampu memberikan layanan lebih efektif mendukung kesiapan kerja lulusan membangun jejaring alumni solid kegiatan studi tiru digelar senin diakhiri sesi tanya jawab pertukaran cenderamata peninjauan langsung ruang kerja pusat karir hubungan alumni ums fikahumas ums,surakarta universitas muhammadiyah palopo um palopo laku kunjung studi tiru universitas muhammadiyah surakarta ums senin november giat langsung ruang sidang rektorat gedung induk siti walidah ums fokus kelola pusat karir hubung alumni pkha kunjung sebut sambut langsung wakil rektor iii ums damping kepala lembaga kembang syarikat kader alumni lpa pimpin pusat karir hubung alumni ums serta jajar sempat sebut rombong um palopo diskus bagi alam kena bagai program strategis jalan ums kembang pusat karir lacak lulus tracer study giat bina karir kuat jaring alumni wakil rektor iii ums dr mutohharun jin mag sambut sampai apresiasi atas kunjung sebut tegas penting kolaborasi antarperguruan tinggi muhammadiyah tingkat mutu layan karir mahasiswa alumni lalu giat studi tiru saling ajar kuat sinergi bangun sistem bina karir lanjut mahasiswa alumni ujar dr mutohharun jin rabu tengah wakil rektor iii ums dr mutohharun jin mag sumber humas ums kunjung harap erat kerja sama lanjut ums um palopo kembang program pusat karir hubung alumni inovatif orientasi butuh dunia kerja foto sama sumber humas ums wakil um palopo dr abdul kad mpsi cas psy sampai giat rupa bagi upaya kuat lembaga pusat karir lingkung um palopo mampu beri layan lebih efektif dukung kesiap kerja lulus bangun jejaring alumni solid giat studi tiru gelar senin akhir sesi tanya jawab tukar cenderamata tinjau langsung ruang kerja pusat karir hubung alumni ums fikahumas ums
