url,title,body,date,body_clean,body_nostop,body_stemmed
https://www.kompasiana.com/ridasepia2637/68f33da034777c4515757372/dari-praktikum-ke-profesionalisme-pelajaran-hidup-dari-dunia-analisis-kimia,Dari Praktikum ke Profesionalisme: Pelajaran Hidup dari Dunia Analisis Kimia,"
Pernahkah kamu membayangkan dunia di balik jas laboratorium putih dan bau asam sulfat yang menyengat? Bagi sebagian orang, mahasiswa analisis kimia sering dianggap sebagai sosok introvert yang hidupnya tak jauh dari tabung reaksi dan laporan praktikum yang menumpuk. Namun di balik rutinitas laboratorium yang tampak monoton itu, tersimpan perjalanan penuh makna yang membentuk karakter, disiplin, dan ketangguhan. Bagi saya, praktikum analisis kimia bukan sekadar eksperimen di meja laboratorium, melainkan sekolah kehidupan yang membentuk pribadi profesional siap menghadapi dunia kerja . Lebih dari Sekadar Reagen dan Laporan: Membangun Karakter Ilmiah
Banyak yang mengira praktikum di laboratorium itu membosankan. Tapi menurut saya dan seperti dijelaskan Ahdila dkk. (2022) praktikum justru seperti petualangan ilmiah yang seru, mulai dari mengamati reaksi kimia yang kadang tak terduga, mengukur cairan dengan teliti, menguji dugaan, lalu menganalisis hasilnya untuk menarik kesimpulan. Proses ini tidak sekadar menghafal rumus, tetapi mengasah kemampuan berpikir kritis, kreatif, dan sistematis. Saya pernah merasa sangat senang ketika hasil percobaan sesuai harapan, namun saya juga pernah frustrasi saat hasilnya melenceng jauh. Dari sini saya belajar bahwa sains bukan tentang jawaban cepat, melainkan perjalanan mencari kebenaran dengan sabar dan teliti.

Keterampilan ini sangat berharga bagi saya sebagai calon analis kimia. Saya harus siap menjadi “detektif ilmiah” yang mampu menemukan penyebab air terkontaminasi atau menyempurnakan formulasi obat di pabrik farmasi. Menurut Suryelita dan Fitriza (2018), berpikir kritis dan membuktikan kebenaran melalui praktikum adalah hal mendasar. Praktikum bukan sekadar mengumpulkan data, tetapi membuktikan hasil dengan bukti nyata. Saya sering merasa puas saat teori yang saya pelajari terbukti benar di laboratorium, seperti saat mengukur kadar logam dengan spektrofotometer atau mengidentifikasi suatu senyawa dengan titrasi. Pengalaman ini membuat saya lebih percaya diri dan siap menerapkannya di dunia kerja. Manajemen Waktu: Bertahan di Tengah Badai Laboratorium

Siapa bilang praktikum selalu selesai dalam sekejap? Sejak pagi saya dan teman-teman sudah menyiapkan alat dan bahan, lalu menunggu reaksi yang berjalan lama. Malamnya, saya masih harus menganalisis data di depan laptop, dikejar tenggat laporan tulis tangan dan tugas kuliah lain yang menumpuk. Rasanya seperti latihan bertahan hidup di tengah badai kesibukan. Tapi dari situ saya belajar mengatur waktu dan menentukan prioritas. Saya belajar tetap fokus meski tubuh lelah dan mata berat. Pelajaran ini sangat berguna di dunia kerja. Dalam proyek besar, satu kesalahan kecil bisa berdampak besar. Di dunia kerja, ketelitian dan manajemen waktu yang saya pelajari dari praktikum menjadi penyelamat yang membedakan antara keberhasilan dan kegagalan proyek jutaan rupiah. Kolaborasi di Balik Meja Uji: Belajar Bekerja Sama
Banyak yang mengira bekerja di laboratorium itu pekerjaan individu. Padahal, saya justru belajar banyak tentang kerja tim. Saya tidak bisa bekerja sendirian karena aturan keselamatan dan keterbatasan alat. Sering kali saya berdiskusi dengan teman kelompok saat hasil percobaan tak sesuai harapan. Percakapan sederhana seperti, “Hasilku beda, kamu sudah cek prosedurnya belum?” sangat membantu. Dari sini saya belajar berkomunikasi dengan jelas, mendengarkan pendapat, dan menyelesaikan masalah bersama. Rasanya seperti latihan kerja tim professional. Bedanya, kami bekerja dengan pipet dan buret, bukan laptop dan presentasi. Kemampuan bekerja sama menjadi bekal berharga bagi saya. Di mana pun saya bekerja, baik di tim R&D, QC, maupun bidang pangan, farmasi, atau pengelolaan limbah. Kolaborasi dan ketelitian akan selalu menjadi kunci untuk menonjol dan berkembang. Dari Lulusan ke Leader: Modal Karier yang Tak Ternilai
Sebagai mahasiswa analisis kimia, saya tahu peluang kerja di bidang ini sangat luas mulai dari analisis lingkungan, minyak dan gas, hingga pemeriksaan kualitas obat dan pangan. Namun saya juga sadar, nilai akademik bukan satu-satunya yang dicari perusahaan. Dunia kerja membutuhkan orang yang berintegritas, disiplin, dan mampu mengambil keputusan berbasis data.
Dari laboratorium, saya belajar semuanya. Saya belajar disiplin karena setiap detik pengukuran penting, saya menjadi tangguh karena tidak semua eksperimen berjalan mulus, dan bertanggung jawab karena kesalahan kecil bisa berdampak besar. Saya teringat seorang analis pangan yang mencegah wabah keracunan berkat ketelitiannya, itulah kekuatan yang ditempa dari praktikum. Laboratorium mengajarkan saya bahwa profesional sejati adalah mereka yang mampu memadukan ilmu, etika, dan ketekunan. Laboratorium, Guru Terbaik dalam Hidup Saya

Bagi saya, praktikum analisis kimia bukan rutinitas akademik, melainkan tempat belajar menjadi pribadi disiplin, teliti, dan kuat. Dari setiap tetes reagen dan lembar laporan, saya belajar bahwa keberhasilan tidak datang instan, melainkan melalui kerja keras dan kesabaran. Jadi, saat saya lelah karena begadang membuat laporan, saya selalu mengingat satu hal: semua ini investasi emas untuk masa depan. Laboratorium bukan musuh yang menakutkan, tetapi sahabat setia yang menempa saya menjadi profesional sejati.

Referensi:
Ahdila AI, Masykuri M, Hastuti B. 2022. Efektivitas pemanfaatan laboratorium dalam pembelajaran kimia di SMA negeri 2 boyolali. Jurnal Pendidikan Kimia. 11(2): 205-210. Doi: https://doi.org/10.20961/lpkim.v11i2.63552",,pernahkah kamu membayangkan dunia di balik jas laboratorium putih dan bau asam sulfat yang menyengat bagi sebagian orang mahasiswa analisis kimia sering dianggap sebagai sosok introvert yang hidupnya tak jauh dari tabung reaksi dan laporan praktikum yang menumpuk namun di balik rutinitas laboratorium yang tampak monoton itu tersimpan perjalanan penuh makna yang membentuk karakter disiplin dan ketangguhan bagi saya praktikum analisis kimia bukan sekadar eksperimen di meja laboratorium melainkan sekolah kehidupan yang membentuk pribadi profesional siap menghadapi dunia kerja  lebih dari sekadar reagen dan laporan membangun karakter ilmiah banyak yang mengira praktikum di laboratorium itu membosankan tapi menurut saya dan seperti dijelaskan ahdila dkk  praktikum justru seperti petualangan ilmiah yang seru mulai dari mengamati reaksi kimia yang kadang tak terduga mengukur cairan dengan teliti menguji dugaan lalu menganalisis hasilnya untuk menarik kesimpulan proses ini tidak sekadar menghafal rumus tetapi mengasah kemampuan berpikir kritis kreatif dan sistematis saya pernah merasa sangat senang ketika hasil percobaan sesuai harapan namun saya juga pernah frustrasi saat hasilnya melenceng jauh dari sini saya belajar bahwa sains bukan tentang jawaban cepat melainkan perjalanan mencari kebenaran dengan sabar dan teliti keterampilan ini sangat berharga bagi saya sebagai calon analis kimia saya harus siap menjadi detektif ilmiah yang mampu menemukan penyebab air terkontaminasi atau menyempurnakan formulasi obat di pabrik farmasi menurut suryelita dan fitriza  berpikir kritis dan membuktikan kebenaran melalui praktikum adalah hal mendasar praktikum bukan sekadar mengumpulkan data tetapi membuktikan hasil dengan bukti nyata saya sering merasa puas saat teori yang saya pelajari terbukti benar di laboratorium seperti saat mengukur kadar logam dengan spektrofotometer atau mengidentifikasi suatu senyawa dengan titrasi pengalaman ini membuat saya lebih percaya diri dan siap menerapkannya di dunia kerja manajemen waktu bertahan di tengah badai laboratorium siapa bilang praktikum selalu selesai dalam sekejap sejak pagi saya dan temanteman sudah menyiapkan alat dan bahan lalu menunggu reaksi yang berjalan lama malamnya saya masih harus menganalisis data di depan laptop dikejar tenggat laporan tulis tangan dan tugas kuliah lain yang menumpuk rasanya seperti latihan bertahan hidup di tengah badai kesibukan tapi dari situ saya belajar mengatur waktu dan menentukan prioritas saya belajar tetap fokus meski tubuh lelah dan mata berat pelajaran ini sangat berguna di dunia kerja dalam proyek besar satu kesalahan kecil bisa berdampak besar di dunia kerja ketelitian dan manajemen waktu yang saya pelajari dari praktikum menjadi penyelamat yang membedakan antara keberhasilan dan kegagalan proyek jutaan rupiah kolaborasi di balik meja uji belajar bekerja sama banyak yang mengira bekerja di laboratorium itu pekerjaan individu padahal saya justru belajar banyak tentang kerja tim saya tidak bisa bekerja sendirian karena aturan keselamatan dan keterbatasan alat sering kali saya berdiskusi dengan teman kelompok saat hasil percobaan tak sesuai harapan percakapan sederhana seperti hasilku beda kamu sudah cek prosedurnya belum sangat membantu dari sini saya belajar berkomunikasi dengan jelas mendengarkan pendapat dan menyelesaikan masalah bersama rasanya seperti latihan kerja tim professional bedanya kami bekerja dengan pipet dan buret bukan laptop dan presentasi kemampuan bekerja sama menjadi bekal berharga bagi saya di mana pun saya bekerja baik di tim rd qc maupun bidang pangan farmasi atau pengelolaan limbah kolaborasi dan ketelitian akan selalu menjadi kunci untuk menonjol dan berkembang dari lulusan ke leader modal karier yang tak ternilai sebagai mahasiswa analisis kimia saya tahu peluang kerja di bidang ini sangat luas mulai dari analisis lingkungan minyak dan gas hingga pemeriksaan kualitas obat dan pangan namun saya juga sadar nilai akademik bukan satusatunya yang dicari perusahaan dunia kerja membutuhkan orang yang berintegritas disiplin dan mampu mengambil keputusan berbasis data dari laboratorium saya belajar semuanya saya belajar disiplin karena setiap detik pengukuran penting saya menjadi tangguh karena tidak semua eksperimen berjalan mulus dan bertanggung jawab karena kesalahan kecil bisa berdampak besar saya teringat seorang analis pangan yang mencegah wabah keracunan berkat ketelitiannya itulah kekuatan yang ditempa dari praktikum laboratorium mengajarkan saya bahwa profesional sejati adalah mereka yang mampu memadukan ilmu etika dan ketekunan laboratorium guru terbaik dalam hidup saya bagi saya praktikum analisis kimia bukan rutinitas akademik melainkan tempat belajar menjadi pribadi disiplin teliti dan kuat dari setiap tetes reagen dan lembar laporan saya belajar bahwa keberhasilan tidak datang instan melainkan melalui kerja keras dan kesabaran jadi saat saya lelah karena begadang membuat laporan saya selalu mengingat satu hal semua ini investasi emas untuk masa depan laboratorium bukan musuh yang menakutkan tetapi sahabat setia yang menempa saya menjadi profesional sejati referensi ahdila ai masykuri m hastuti b  efektivitas pemanfaatan laboratorium dalam pembelajaran kimia di sma negeri  boyolali jurnal pendidikan kimia   doi,pernahkah kamu membayangkan dunia balik jas laboratorium putih bau asam sulfat menyengat sebagian orang mahasiswa analisis kimia sering dianggap sosok introvert hidupnya tak jauh tabung reaksi laporan praktikum menumpuk balik rutinitas laboratorium tampak monoton tersimpan perjalanan penuh makna membentuk karakter disiplin ketangguhan praktikum analisis kimia bukan sekadar eksperimen meja laboratorium sekolah kehidupan membentuk pribadi profesional siap menghadapi dunia kerja lebih sekadar reagen laporan membangun karakter ilmiah banyak mengira praktikum laboratorium membosankan dijelaskan ahdila dkk praktikum justru petualangan ilmiah seru mulai mengamati reaksi kimia kadang tak terduga mengukur cairan teliti menguji dugaan lalu menganalisis hasilnya menarik kesimpulan proses sekadar menghafal rumus mengasah kemampuan berpikir kritis kreatif sistematis pernah merasa sangat senang hasil percobaan sesuai harapan pernah frustrasi hasilnya melenceng jauh sini belajar sains bukan jawaban cepat perjalanan mencari kebenaran sabar teliti keterampilan sangat berharga calon analis kimia siap menjadi detektif ilmiah mampu menemukan penyebab air terkontaminasi menyempurnakan formulasi obat pabrik farmasi suryelita fitriza berpikir kritis membuktikan kebenaran melalui praktikum mendasar praktikum bukan sekadar mengumpulkan data membuktikan hasil bukti nyata sering merasa puas teori pelajari terbukti benar laboratorium mengukur kadar logam spektrofotometer mengidentifikasi suatu senyawa titrasi pengalaman membuat lebih percaya diri siap menerapkannya dunia kerja manajemen waktu bertahan tengah badai laboratorium siapa bilang praktikum selalu selesai sekejap sejak pagi temanteman menyiapkan alat bahan lalu menunggu reaksi berjalan lama malamnya menganalisis data depan laptop dikejar tenggat laporan tulis tangan tugas kuliah menumpuk rasanya latihan bertahan hidup tengah badai kesibukan situ belajar mengatur waktu menentukan prioritas belajar tetap fokus meski tubuh lelah mata berat pelajaran sangat berguna dunia kerja proyek besar satu kesalahan kecil berdampak besar dunia kerja ketelitian manajemen waktu pelajari praktikum menjadi penyelamat membedakan keberhasilan kegagalan proyek jutaan rupiah kolaborasi balik meja uji belajar bekerja sama banyak mengira bekerja laboratorium pekerjaan individu padahal justru belajar banyak kerja tim bekerja sendirian aturan keselamatan keterbatasan alat sering kali berdiskusi teman kelompok hasil percobaan tak sesuai harapan percakapan sederhana hasilku beda kamu cek prosedurnya sangat membantu sini belajar berkomunikasi jelas mendengarkan pendapat menyelesaikan masalah bersama rasanya latihan kerja tim professional bedanya bekerja pipet buret bukan laptop presentasi kemampuan bekerja sama menjadi bekal berharga mana bekerja baik tim rd qc maupun bidang pangan farmasi pengelolaan limbah kolaborasi ketelitian selalu menjadi kunci menonjol berkembang lulusan leader modal karier tak ternilai mahasiswa analisis kimia tahu peluang kerja bidang sangat luas mulai analisis lingkungan minyak gas hingga pemeriksaan kualitas obat pangan sadar nilai akademik bukan satusatunya dicari perusahaan dunia kerja membutuhkan orang berintegritas disiplin mampu mengambil keputusan berbasis data laboratorium belajar semuanya belajar disiplin detik pengukuran penting menjadi tangguh semua eksperimen berjalan mulus bertanggung jawab kesalahan kecil berdampak besar teringat seorang analis pangan mencegah wabah keracunan berkat ketelitiannya kekuatan ditempa praktikum laboratorium mengajarkan profesional sejati mampu memadukan ilmu etika ketekunan laboratorium guru terbaik hidup praktikum analisis kimia bukan rutinitas akademik tempat belajar menjadi pribadi disiplin teliti kuat tetes reagen lembar laporan belajar keberhasilan datang instan melalui kerja keras kesabaran jadi lelah begadang membuat laporan selalu mengingat satu semua investasi emas masa depan laboratorium bukan musuh menakutkan sahabat setia menempa menjadi profesional sejati referensi ahdila ai masykuri m hastuti b efektivitas pemanfaatan laboratorium pembelajaran kimia sma negeri boyolali jurnal pendidikan kimia doi,pernah kamu bayang dunia balik jas laboratorium putih bau asam sulfat sengat bagi orang mahasiswa analisis kimia sering anggap sosok introvert hidup tak jauh tabung reaksi lapor praktikum tumpuk balik rutinitas laboratorium tampak monoton simpan jalan penuh makna bentuk karakter disiplin tangguh praktikum analisis kimia bukan sekadar eksperimen meja laboratorium sekolah hidup bentuk pribadi profesional siap hadap dunia kerja lebih sekadar reagen lapor bangun karakter ilmiah banyak ira praktikum laboratorium bosan jelas ahdila dkk praktikum justru tualang ilmiah seru mulai amat reaksi kimia kadang tak duga ukur cair teliti uji duga lalu analis hasil tarik simpul proses sekadar hafal rumus asah mampu pikir kritis kreatif sistematis pernah rasa sangat senang hasil coba sesuai harap pernah frustrasi hasil lenceng jauh sini ajar sains bukan jawab cepat jalan cari benar sabar teliti terampil sangat harga calon analis kimia siap jadi detektif ilmiah mampu temu sebab air kontaminasi sempurna formulasi obat pabrik farmasi suryelita fitriza pikir kritis bukti benar lalu praktikum dasar praktikum bukan sekadar kumpul data bukti hasil bukti nyata sering rasa puas teori ajar bukti benar laboratorium ukur kadar logam spektrofotometer identifikasi suatu senyawa titrasi alam buat lebih percaya diri siap terap dunia kerja manajemen waktu tahan tengah badai laboratorium siapa bilang praktikum selalu selesai kejap sejak pagi temanteman siap alat bahan lalu tunggu reaksi jalan lama malam analis data depan laptop kejar tenggat lapor tulis tangan tugas kuliah tumpuk rasa latih tahan hidup tengah badai sibuk situ ajar atur waktu tentu prioritas ajar tetap fokus meski tubuh lelah mata berat ajar sangat guna dunia kerja proyek besar satu salah kecil dampak besar dunia kerja teliti manajemen waktu ajar praktikum jadi selamat beda hasil gagal proyek juta rupiah kolaborasi balik meja uji ajar kerja sama banyak ira kerja laboratorium kerja individu padahal justru ajar banyak kerja tim kerja sendiri atur selamat batas alat sering kali diskus teman kelompok hasil coba tak sesuai harap cakap sederhana hasil beda kamu cek prosedur sangat bantu sini ajar komunikasi jelas dengar dapat selesai masalah sama rasa latih kerja tim professional beda kerja pipet buret bukan laptop presentasi mampu kerja sama jadi bekal harga mana kerja baik tim rd qc maupun bidang pangan farmasi kelola limbah kolaborasi teliti selalu jadi kunci tonjol kembang lulus leader modal karier tak nilai mahasiswa analisis kimia tahu peluang kerja bidang sangat luas mulai analisis lingkung minyak gas hingga periksa kualitas obat pangan sadar nilai akademik bukan satusatunya cari usaha dunia kerja butuh orang integritas disiplin mampu ambil putus bas data laboratorium ajar semua ajar disiplin detik ukur penting jadi tangguh semua eksperimen jalan mulus tanggung jawab salah kecil dampak besar ingat orang analis pangan cegah wabah racun berkat teliti kuat tempa praktikum laboratorium ajar profesional sejati mampu madu ilmu etika tekun laboratorium guru baik hidup praktikum analisis kimia bukan rutinitas akademik tempat ajar jadi pribadi disiplin teliti kuat tetes reagen lembar lapor ajar hasil datang instan lalu kerja keras sabar jadi lelah begadang buat lapor selalu ingat satu semua investasi emas masa depan laboratorium bukan musuh takut sahabat setia tempa jadi profesional sejati referensi ahdila ai masykuri m hastuti b efektivitas manfaat laboratorium ajar kimia sma negeri boyolali jurnal didik kimia doi
https://www.kompasiana.com/nuningsapta1219/68f5a4ea34777c5cc2483584/setelah-wisuda-lalu-apa-menyambut-realitas-di-balik-toga-dan-selebrasi,"Setelah Wisuda, Lalu Apa?","Menyambut Realitas di Balik Toga dan Selebrasi
Sorak sorai di aula wisuda memuncak ketika ribuan toga hitam melayang ke udara, menandai berakhirnya satu bab perjalanan panjang. Setelah bertahun-tahun berkutat dengan tugas, revisi, dan skripsi yang tak kunjung rampung, akhirnya semua terbayar.
Tangis haru di pelukan orang tua, senyum bangga teman seperjuangan, hingga unggahan foto toga di media sosial menjadi bukti: perjuangan telah usai.

Namun, setelah pesta bunga, ucapan selamat, dan deretan ucapan “congratulations!” di kolom komentar, sunyi mulai datang. Pertanyaan yang sering kali tak diucapkan mulai bergema di kepala: Setelah wisuda, lalu apa?
Baca juga: Mengelola Emosi dengan Dzikir: Sains dan Spiritual dalam Islam

Babak Akhir dari Perjalanan Panjang
Bagi sebagian orang, wisuda adalah akhir dari sebuah maraton penuh air mata dan keringat. Ada yang harus berjuang sambil bekerja, ada yang dikejar tenggat waktu penelitian, ada pula yang hampir menyerah karena revisi dosen pembimbing yang tak kunjung berhenti.
Tak sedikit yang menjalani malam demi malam tanpa tidur, hanya ditemani secangkir kopi dan rasa cemas yang tak kunjung reda. Tetapi justru di sanalah makna sebenarnya dari perjalanan akademik: bukan hanya tentang kecerdasan, tapi tentang keteguhan, ketekunan, dan daya tahan mental.
Ketika akhirnya lembar pengesahan ditandatangani, bukan hanya skripsi yang selesai, tetapi juga pembuktian bahwa seseorang mampu bertahan hingga garis akhir.
Baca juga: Teknologi dengan Hati: Inovasi Digital Untuk Pembelajaran ABK

Selebrasi yang Singkat, Realitas yang Panjang

Baca juga: Bocce: Bola Kecil yang Membuka Ruang Besar untuk ABK
Hari wisuda datang seperti mimpi. Jas disetrika rapi, toga disiapkan, kamera siap mengabadikan setiap momen.
Rasanya bahagia, tapi singkat. Sebab setelah acara selesai, setelah bunga layu dan toga dilipat, kehidupan kembali berjalan.",,menyambut realitas di balik toga dan selebrasi sorak sorai di aula wisuda memuncak ketika ribuan toga hitam melayang ke udara menandai berakhirnya satu bab perjalanan panjang setelah bertahuntahun berkutat dengan tugas revisi dan skripsi yang tak kunjung rampung akhirnya semua terbayar tangis haru di pelukan orang tua senyum bangga teman seperjuangan hingga unggahan foto toga di media sosial menjadi bukti perjuangan telah usai namun setelah pesta bunga ucapan selamat dan deretan ucapan congratulations di kolom komentar sunyi mulai datang pertanyaan yang sering kali tak diucapkan mulai bergema di kepala setelah wisuda lalu apa  mengelola emosi dengan dzikir sains dan spiritual dalam islam babak akhir dari perjalanan panjang bagi sebagian orang wisuda adalah akhir dari sebuah maraton penuh air mata dan keringat ada yang harus berjuang sambil bekerja ada yang dikejar tenggat waktu penelitian ada pula yang hampir menyerah karena revisi dosen pembimbing yang tak kunjung berhenti tak sedikit yang menjalani malam demi malam tanpa tidur hanya ditemani secangkir kopi dan rasa cemas yang tak kunjung reda tetapi justru di sanalah makna sebenarnya dari perjalanan akademik bukan hanya tentang kecerdasan tapi tentang keteguhan ketekunan dan daya tahan mental ketika akhirnya lembar pengesahan ditandatangani bukan hanya skripsi yang selesai tetapi juga pembuktian bahwa seseorang mampu bertahan hingga garis akhir  teknologi dengan hati inovasi digital untuk pembelajaran abk selebrasi yang singkat realitas yang panjang  bocce bola kecil yang membuka ruang besar untuk abk hari wisuda datang seperti mimpi jas disetrika rapi toga disiapkan kamera siap mengabadikan setiap momen rasanya bahagia tapi singkat sebab setelah acara selesai setelah bunga layu dan toga dilipat kehidupan kembali berjalan,menyambut realitas balik toga selebrasi sorak sorai aula wisuda memuncak ribuan toga hitam melayang udara menandai berakhirnya satu bab perjalanan panjang bertahuntahun berkutat tugas revisi skripsi tak kunjung rampung akhirnya semua terbayar tangis haru pelukan orang tua senyum bangga teman seperjuangan hingga unggahan foto toga media sosial menjadi bukti perjuangan usai pesta bunga ucapan selamat deretan ucapan congratulations kolom komentar sunyi mulai datang pertanyaan sering kali tak diucapkan mulai bergema kepala wisuda lalu apa mengelola emosi dzikir sains spiritual islam babak akhir perjalanan panjang sebagian orang wisuda akhir sebuah maraton penuh air mata keringat berjuang bekerja dikejar tenggat waktu penelitian hampir menyerah revisi dosen pembimbing tak kunjung berhenti tak sedikit menjalani malam malam tidur ditemani secangkir kopi rasa cemas tak kunjung reda justru sanalah makna sebenarnya perjalanan akademik bukan kecerdasan keteguhan ketekunan daya tahan mental akhirnya lembar pengesahan ditandatangani bukan skripsi selesai pembuktian seseorang mampu bertahan hingga garis akhir teknologi hati inovasi digital pembelajaran abk selebrasi singkat realitas panjang bocce bola kecil membuka ruang besar abk hari wisuda datang mimpi jas disetrika rapi toga disiapkan kamera siap mengabadikan momen rasanya bahagia singkat acara selesai bunga layu toga dilipat kehidupan berjalan,sambut realitas balik toga selebrasi sorak sorai aula wisuda puncak ribu toga hitam layang udara tanda akhir satu bab jalan panjang bertahuntahun kutat tugas revisi skripsi tak kunjung rampung akhir semua bayar tangis haru peluk orang tua senyum bangga teman juang hingga unggah foto toga media sosial jadi bukti juang usai pesta bunga ucap selamat deret ucap congratulations kolom komentar sunyi mulai datang tanya sering kali tak ucap mulai gema kepala wisuda lalu apa kelola emosi dzikir sains spiritual islam babak akhir jalan panjang bagi orang wisuda akhir buah maraton penuh air mata keringat juang kerja kejar tenggat waktu teliti hampir serah revisi dosen bimbing tak kunjung henti tak sedikit jalan malam malam tidur tani cangkir kopi rasa cemas tak kunjung reda justru sana makna benar jalan akademik bukan cerdas teguh tekun daya tahan mental akhir lembar kesah ditandatangani bukan skripsi selesai bukti orang mampu tahan hingga garis akhir teknologi hati inovasi digital ajar abk selebrasi singkat realitas panjang bocce bola kecil buka ruang besar abk hari wisuda datang mimpi jas setrika rapi toga siap kamera siap abadi momen rasa bahagia singkat acara selesai bunga layu toga lipat hidup jalan
