url,title,body,date,body_clean,body_nostop,body_stemmed
https://www.kompasiana.com/hanawahyu6307/68fa3b03c925c448b0638dd2/organisasi-vs-magang-mana-yang-paling-penting-bagi-mahasiswa,Organisasi vs Magang: Mana yang Paling Penting bagi Mahasiswa?,"
Sebagai seorang mahasiswa , saya menyadari betul bawah setelah memasuki dunia kampus, ini merupakan saat yang tepat untuk meningkatkan kemampuan setiap individu baik itu hard skill maupun soft skill. Maka dari itu, kampus harus bisa menjadi tempat yang mampu memberikan akses bagi mahasiswanya untuk berkembang dengan menyelenggarakan berbagai kegiatan positif dan menarik.
Salah satunya melalui organisasi kampus, seperti Badan Eksekutif mahasiswa (BEM), Dewan Perwakilan mahasiswa (DPM), dan Himpunan Mahasiswa (HIMA). Selain itu, kampus juga menyediakan sarana pengembangan skill mahasiswa dengan dibentuk berbagai Unit Kegiatan Mahasiswa (UKM) yang dapat diikuti oleh mahasiswa berdasarkan minat dan bakatnya masing-masing.

Sebagian mahasiswa juga memiliki caranya sendiri untuk meningkatkan skill mereka dengan aktif mengikuti kegiatan di luar kampus, yaitu dengan mengikuti kegiatan magang . Bahkan ada mahasiswa yang sudah aktif magang dari awal-awal semester.

Apalagi jika kita mengingat pasar kerja di Indonesia saat ini yang kebanyakan menuntut mahasiswa untuk memiliki pengalaman magang sebelum lulus. Tentu saja, ini membuat mahasiswa begitu gencar dalam mengikuti kegiatan magang.
Dari kedua permasalahan tersebut, tidak sedikit ternyata mahasiswa yang merasa dilema dalam menentukan mana pilihan yang terbaik antara memilih ikut organisasi atau magang. Atau mungkin kamu salah satunya?
Izinkan saya untuk mengulasnya berdasarkan pengalaman pribadi sebagai mahasiswa yang pernah berorganisasi di kampus sekaligus mahasiswa yang kini tengah mengikuti magang sebagai content writer. Pilihlah Organisasi Jika Kamu..... Mahasiswa tahun pertama atau kedua : Tahun awal kuliah adalah saat bagi kamu untuk beradaptasi dengan  lingkungan kampus dan membangun fondasi. Ini juga saat yang tepat untuk kamu meningkatkan soft skill secara serius, seperti skill komunikasi, kepemimpinan, negosiasi, disiplin waktu, koordinasi & kerjasama tim, dan skill lainnya yang tak kalah penting. Ingin membangun relasi internal : Relasi adalah kunci. Hubungan baik yang kamu jalin dengan teman seangkatan, kakak tingkat, alumni, hingga dosen bisa meningkatkan peluang untuk memperoleh banyak informasi yang mungkin jarang disiarkan secara publik. Hal yang perlu diingat, terkadang tidak semua orang yang kita kenal bisa menjadi sumber informasi yang menjanjikan. Maka, pintar-pintarlah dalam berjejaring. Bolehlah berteman dengan siapapun, tapi pilih-pilihlah dalam bergaul karena dengan siapa kamu bergaul itu akan menentukan siapa juga dirimu saat ini bahkan di masa depan. Ingin mencoba peran dan temukan minat : Saat yang tepat untuk eksplorasi! Dalam organisasi, biasanya terdapat struktur organisasi kepengurusan, seperti ketua, sekretaris, bendahara, maupun divisi atau departemen di bawahnya dengan tanggung jawab yang tentunya berbeda-beda. Kamu bisa mulai menemukan 'calon' karirmu disini. Kenyataannya, tidak sedikit juga orang yang saat ini memegang posisi tertentu di ranah profesional yang ternyata semuanya berawal dari organisasi yang mereka ikuti saat di lingkungan kampus. Kabar baiknya, jika kamu merasa kurang cocok di posisi ini kamu tidak memiliki tuntutan profesional yang bersifat kaku. Sehingga organisasi adalah jawaban yang cocok untuk kamu yang merasa belum menemukan passionmu dimana. Tertarik mengelola proyek atau acara : Organisasi kampus, biasanya memiliki sejumlah program kerja yang akan dilakukan dalam satu periode kepengurusan. Program kerja inilah yang bisa memberikan kamu real proyek dan dapat menjadi nilai tambah. Kamu bisa menjadi ketua acara, sekretaris kegiatan bendahara kegiatan, dan posisi lainnya yang sesuai minatmu. Kamu juga akan belajar untuk mengeksekusi sebuah program dari awal membuat konsep hingga eksekusi kegiatan. Untuk merencanakan semua itu, tentu saja kamu akan dituntut untuk memperlihatkan soft skill dan juga hard skill mu.
Perlu diingat, berorganisasi juga dilandasi oleh rasa tanggung jawab dan tidak mengabaikan akademik. Jadi, pastikan untuk berkomitmen sampai akhir sebagai bentuk keseriusan dan profesionalisme mu yang mana ini juga bagian dari soft skill penting. Pilih Magang Jika Kamu.... Sudah memasuki minimal semester 5 : Sebenarnya tidak ada ketentuan khusus untuk ikut magang harus semester 5. Hanya saja, di semester ini mata kuliah wajib biasanya sudah hampir selesai dan sisanya bisa dikonversi saat magang. Fondasimu sudah cukup terutama jika posisi magangmu nanti berkaitan dengan jurusanmu juga. Maka dari itu kenapa di semester ini kamu sudah cukup untuk mulai ikut magang. Ingin mendapat pengalaman kerja nyata : Masih bersambung dengan yang sebelumnya. Setelah empat semester kamu mengenyam pendidikan di bangku kuliah, saatnya bagimu untuk mendapat pengalaman kerja nyata yang dapat kamu implementasikan di dunia kerja . Ini jadi awal yang baik sebelum nanti kamu masuk ke dunia kerja yang sebenarnya dengan limpahan tanggungjawab yang tentunya lebih berat. Selain itu, jika mengalami kesulitan saat magang, setidaknya kamu masih bisa meminta bantuan kepada mentor untuk membantu mengerjakan tugasmu. Ingin membangun portofolio : Portofolio adalah semacam rekam jejak yang berisi hasil kerja nyata dari posisi yang pernah kamu duduki. Dengan mengikuti magang, kamu bisa memiliki bukti kalau kamu pernah bertanggung jawab dalam melakukan sebuah tindakan dan ini bisa menjadi nilai tambah di mata HRD saat kamu akan bekerja di ranah profesional. Bahkan, di beberapa posisi tertentu seperti di industri kreatif (desain, content creator, copywriting, dll) mewajibkan kamu untuk memiliki portofolio. Maka dari itu, dengan magang ini bisa jadi kesempatan emas untuk membangun nilaimu. Ingin memperluas relasi eksternal : Kalo di organisasi kita memperluas jejaring di internal, sekarang saatnya kita show up ke eksternal. Kita akan bertemu dengan banyak orang dan background yang lebih beragam. Kamu bisa membangun hubungan yang baik dengan HRD, manager di perusahaan magang, calon atasan, mentor saat magang (jika ada), bahkan dengan calon konsumen/klien perusahaan pun bisa (tergantung perusahaan dan posisi yang kamu tempati). Nah, ini adalah waktu yang tepat juga buat kamu untuk asah interpersonal skill dengan menjadi pribadi yang menyenangkan dan easy going untuk diajak berinteraksi. Ingin mengubah status menjadi kandidat yang siap direkrut : Kalo kamu sudah cocok dari segi skill, punya portofolio, tahu bagaimana alur dunia kerja, dan sudah menemukan posisi yang match buat kamu. Tandanya kamu udah cocok buat magang dan ambil posisi serius sesuai kriteria kamu. Di tahap ini, kamu jangan gampang merasa puas dan harus terus upgrade biar skill kamu sesuai dengan kebutuhan pasar.

Baik organisasi maupun magang, keduanya sama-sama memiliki keunggulan dan kekurangan masing-masing. Namun, berdasarkan apa yang saya alami keduanya memiliki keterkaitan satu sama lain. Dimulai dari kenali diri sendiri dan bangun fondasi lewat organisasi, kemudian praktek ke dunia kerja untuk implementasi soft skill dan pemahaman selama di dunia kampus.

Namun, pada intinya, apapun yang kamu pilih. Jangan lupa untuk benar-benar sadari dengan kemampuanmu dan jangan sampai salah langkah. Perlahan, namun tetap pasti dan nikmati perjalananmu selama dunia kampus berlangsung dengan penuh bahagia.
Follow Instagram @kompasianacom juga Tiktok @kompasiana biar nggak ketinggalan event seru komunitas dan tips dapat cuan dari Kompasiana . Baca juga cerita inspiratif langsung dari smartphone kamu dengan bergabung di WhatsApp Channel Kompasiana di SINI",,sebagai seorang mahasiswa  saya menyadari betul bawah setelah memasuki dunia kampus ini merupakan saat yang tepat untuk meningkatkan kemampuan setiap individu baik itu hard skill maupun soft skill maka dari itu kampus harus bisa menjadi tempat yang mampu memberikan akses bagi mahasiswanya untuk berkembang dengan menyelenggarakan berbagai kegiatan positif dan menarik salah satunya melalui organisasi kampus seperti badan eksekutif mahasiswa bem dewan perwakilan mahasiswa dpm dan himpunan mahasiswa hima selain itu kampus juga menyediakan sarana pengembangan skill mahasiswa dengan dibentuk berbagai unit kegiatan mahasiswa ukm yang dapat diikuti oleh mahasiswa berdasarkan minat dan bakatnya masingmasing sebagian mahasiswa juga memiliki caranya sendiri untuk meningkatkan skill mereka dengan aktif mengikuti kegiatan di luar kampus yaitu dengan mengikuti kegiatan magang  bahkan ada mahasiswa yang sudah aktif magang dari awalawal semester apalagi jika kita mengingat pasar kerja di indonesia saat ini yang kebanyakan menuntut mahasiswa untuk memiliki pengalaman magang sebelum lulus tentu saja ini membuat mahasiswa begitu gencar dalam mengikuti kegiatan magang dari kedua permasalahan tersebut tidak sedikit ternyata mahasiswa yang merasa dilema dalam menentukan mana pilihan yang terbaik antara memilih ikut organisasi atau magang atau mungkin kamu salah satunya izinkan saya untuk mengulasnya berdasarkan pengalaman pribadi sebagai mahasiswa yang pernah berorganisasi di kampus sekaligus mahasiswa yang kini tengah mengikuti magang sebagai content writer pilihlah organisasi jika kamu mahasiswa tahun pertama atau kedua  tahun awal kuliah adalah saat bagi kamu untuk beradaptasi dengan lingkungan kampus dan membangun fondasi ini juga saat yang tepat untuk kamu meningkatkan soft skill secara serius seperti skill komunikasi kepemimpinan negosiasi disiplin waktu koordinasi  kerjasama tim dan skill lainnya yang tak kalah penting ingin membangun relasi internal  relasi adalah kunci hubungan baik yang kamu jalin dengan teman seangkatan kakak tingkat alumni hingga dosen bisa meningkatkan peluang untuk memperoleh banyak informasi yang mungkin jarang disiarkan secara publik hal yang perlu diingat terkadang tidak semua orang yang kita kenal bisa menjadi sumber informasi yang menjanjikan maka pintarpintarlah dalam berjejaring bolehlah berteman dengan siapapun tapi pilihpilihlah dalam bergaul karena dengan siapa kamu bergaul itu akan menentukan siapa juga dirimu saat ini bahkan di masa depan ingin mencoba peran dan temukan minat  saat yang tepat untuk eksplorasi dalam organisasi biasanya terdapat struktur organisasi kepengurusan seperti ketua sekretaris bendahara maupun divisi atau departemen di bawahnya dengan tanggung jawab yang tentunya berbedabeda kamu bisa mulai menemukan calon karirmu disini kenyataannya tidak sedikit juga orang yang saat ini memegang posisi tertentu di ranah profesional yang ternyata semuanya berawal dari organisasi yang mereka ikuti saat di lingkungan kampus kabar baiknya jika kamu merasa kurang cocok di posisi ini kamu tidak memiliki tuntutan profesional yang bersifat kaku sehingga organisasi adalah jawaban yang cocok untuk kamu yang merasa belum menemukan passionmu dimana tertarik mengelola proyek atau acara  organisasi kampus biasanya memiliki sejumlah program kerja yang akan dilakukan dalam satu periode kepengurusan program kerja inilah yang bisa memberikan kamu real proyek dan dapat menjadi nilai tambah kamu bisa menjadi ketua acara sekretaris kegiatan bendahara kegiatan dan posisi lainnya yang sesuai minatmu kamu juga akan belajar untuk mengeksekusi sebuah program dari awal membuat konsep hingga eksekusi kegiatan untuk merencanakan semua itu tentu saja kamu akan dituntut untuk memperlihatkan soft skill dan juga hard skill mu perlu diingat berorganisasi juga dilandasi oleh rasa tanggung jawab dan tidak mengabaikan akademik jadi pastikan untuk berkomitmen sampai akhir sebagai bentuk keseriusan dan profesionalisme mu yang mana ini juga bagian dari soft skill penting pilih magang jika kamu sudah memasuki minimal semester   sebenarnya tidak ada ketentuan khusus untuk ikut magang harus semester  hanya saja di semester ini mata kuliah wajib biasanya sudah hampir selesai dan sisanya bisa dikonversi saat magang fondasimu sudah cukup terutama jika posisi magangmu nanti berkaitan dengan jurusanmu juga maka dari itu kenapa di semester ini kamu sudah cukup untuk mulai ikut magang ingin mendapat pengalaman kerja nyata  masih bersambung dengan yang sebelumnya setelah empat semester kamu mengenyam pendidikan di bangku kuliah saatnya bagimu untuk mendapat pengalaman kerja nyata yang dapat kamu implementasikan di dunia kerja  ini jadi awal yang baik sebelum nanti kamu masuk ke dunia kerja yang sebenarnya dengan limpahan tanggungjawab yang tentunya lebih berat selain itu jika mengalami kesulitan saat magang setidaknya kamu masih bisa meminta bantuan kepada mentor untuk membantu mengerjakan tugasmu ingin membangun portofolio  portofolio adalah semacam rekam jejak yang berisi hasil kerja nyata dari posisi yang pernah kamu duduki dengan mengikuti magang kamu bisa memiliki bukti kalau kamu pernah bertanggung jawab dalam melakukan sebuah tindakan dan ini bisa menjadi nilai tambah di mata hrd saat kamu akan bekerja di ranah profesional bahkan di beberapa posisi tertentu seperti di industri kreatif desain content creator copywriting dll mewajibkan kamu untuk memiliki portofolio maka dari itu dengan magang ini bisa jadi kesempatan emas untuk membangun nilaimu ingin memperluas relasi eksternal  kalo di organisasi kita memperluas jejaring di internal sekarang saatnya kita show up ke eksternal kita akan bertemu dengan banyak orang dan background yang lebih beragam kamu bisa membangun hubungan yang baik dengan hrd manager di perusahaan magang calon atasan mentor saat magang jika ada bahkan dengan calon konsumenklien perusahaan pun bisa tergantung perusahaan dan posisi yang kamu tempati nah ini adalah waktu yang tepat juga buat kamu untuk asah interpersonal skill dengan menjadi pribadi yang menyenangkan dan easy going untuk diajak berinteraksi ingin mengubah status menjadi kandidat yang siap direkrut  kalo kamu sudah cocok dari segi skill punya portofolio tahu bagaimana alur dunia kerja dan sudah menemukan posisi yang match buat kamu tandanya kamu udah cocok buat magang dan ambil posisi serius sesuai kriteria kamu di tahap ini kamu jangan gampang merasa puas dan harus terus upgrade biar skill kamu sesuai dengan kebutuhan pasar baik organisasi maupun magang keduanya samasama memiliki keunggulan dan kekurangan masingmasing namun berdasarkan apa yang saya alami keduanya memiliki keterkaitan satu sama lain dimulai dari kenali diri sendiri dan bangun fondasi lewat organisasi kemudian praktek ke dunia kerja untuk implementasi soft skill dan pemahaman selama di dunia kampus namun pada intinya apapun yang kamu pilih jangan lupa untuk benarbenar sadari dengan kemampuanmu dan jangan sampai salah langkah perlahan namun tetap pasti dan nikmati perjalananmu selama dunia kampus berlangsung dengan penuh bahagia follow instagram kompasianacom juga tiktok kompasiana biar nggak ketinggalan event seru komunitas dan tips dapat cuan dari kompasiana   cerita inspiratif langsung dari smartphone kamu dengan bergabung di whatsapp channel kompasiana di sini,seorang mahasiswa menyadari betul bawah memasuki dunia kampus merupakan tepat meningkatkan kemampuan individu baik hard skill maupun soft skill kampus menjadi tempat mampu memberikan akses mahasiswanya berkembang menyelenggarakan berbagai kegiatan positif menarik salah satunya melalui organisasi kampus badan eksekutif mahasiswa bem dewan perwakilan mahasiswa dpm himpunan mahasiswa hima kampus menyediakan sarana pengembangan skill mahasiswa dibentuk berbagai unit kegiatan mahasiswa ukm diikuti mahasiswa berdasarkan minat bakatnya masingmasing sebagian mahasiswa memiliki caranya sendiri meningkatkan skill aktif mengikuti kegiatan luar kampus mengikuti kegiatan magang bahkan mahasiswa aktif magang awalawal semester mengingat pasar kerja indonesia kebanyakan menuntut mahasiswa memiliki pengalaman magang lulus membuat mahasiswa gencar mengikuti kegiatan magang kedua permasalahan tersebut sedikit ternyata mahasiswa merasa dilema menentukan mana pilihan terbaik memilih ikut organisasi magang mungkin kamu salah satunya izinkan mengulasnya berdasarkan pengalaman pribadi mahasiswa pernah berorganisasi kampus sekaligus mahasiswa kini tengah mengikuti magang content writer pilihlah organisasi kamu mahasiswa tahun pertama kedua tahun awal kuliah kamu beradaptasi lingkungan kampus membangun fondasi tepat kamu meningkatkan soft skill serius skill komunikasi kepemimpinan negosiasi disiplin waktu koordinasi kerjasama tim skill lainnya tak kalah penting membangun relasi internal relasi kunci hubungan baik kamu jalin teman seangkatan kakak tingkat alumni hingga dosen meningkatkan peluang memperoleh banyak informasi mungkin jarang disiarkan publik perlu diingat terkadang semua orang kenal menjadi sumber informasi menjanjikan pintarpintarlah berjejaring bolehlah berteman siapapun pilihpilihlah bergaul siapa kamu bergaul menentukan siapa dirimu bahkan masa depan mencoba peran temukan minat tepat eksplorasi organisasi biasanya terdapat struktur organisasi kepengurusan ketua sekretaris bendahara maupun divisi departemen bawahnya tanggung jawab tentunya berbedabeda kamu mulai menemukan calon karirmu disini kenyataannya sedikit orang memegang posisi tertentu ranah profesional ternyata semuanya berawal organisasi ikuti lingkungan kampus kabar baiknya kamu merasa kurang cocok posisi kamu memiliki tuntutan profesional bersifat kaku organisasi jawaban cocok kamu merasa menemukan passionmu tertarik mengelola proyek acara organisasi kampus biasanya memiliki sejumlah program kerja dilakukan satu periode kepengurusan program kerja inilah memberikan kamu real proyek menjadi nilai tambah kamu menjadi ketua acara sekretaris kegiatan bendahara kegiatan posisi lainnya sesuai minatmu kamu belajar mengeksekusi sebuah program awal membuat konsep hingga eksekusi kegiatan merencanakan semua kamu dituntut memperlihatkan soft skill hard skill mu perlu diingat berorganisasi dilandasi rasa tanggung jawab mengabaikan akademik jadi pastikan berkomitmen akhir bentuk keseriusan profesionalisme mu mana bagian soft skill penting pilih magang kamu memasuki minimal semester sebenarnya ketentuan khusus ikut magang semester semester mata kuliah wajib biasanya hampir selesai sisanya dikonversi magang fondasimu cukup terutama posisi magangmu berkaitan jurusanmu semester kamu cukup mulai ikut magang mendapat pengalaman kerja nyata bersambung sebelumnya empat semester kamu mengenyam pendidikan bangku kuliah saatnya bagimu mendapat pengalaman kerja nyata kamu implementasikan dunia kerja jadi awal baik kamu masuk dunia kerja sebenarnya limpahan tanggungjawab tentunya lebih berat mengalami kesulitan magang kamu meminta bantuan mentor membantu mengerjakan tugasmu membangun portofolio portofolio semacam rekam jejak berisi hasil kerja nyata posisi pernah kamu duduki mengikuti magang kamu memiliki bukti kalau kamu pernah bertanggung jawab melakukan sebuah tindakan menjadi nilai tambah mata hrd kamu bekerja ranah profesional bahkan beberapa posisi tertentu industri kreatif desain content creator copywriting mewajibkan kamu memiliki portofolio magang jadi kesempatan emas membangun nilaimu memperluas relasi eksternal kalo organisasi memperluas jejaring internal sekarang saatnya show up eksternal bertemu banyak orang background lebih beragam kamu membangun hubungan baik hrd manager perusahaan magang calon atasan mentor magang bahkan calon konsumenklien perusahaan tergantung perusahaan posisi kamu tempati nah waktu tepat buat kamu asah interpersonal skill menjadi pribadi menyenangkan easy going diajak berinteraksi mengubah status menjadi kandidat siap direkrut kalo kamu cocok segi skill punya portofolio tahu bagaimana alur dunia kerja menemukan posisi match buat kamu tandanya kamu udah cocok buat magang ambil posisi serius sesuai kriteria kamu tahap kamu jangan gampang merasa puas terus upgrade biar skill kamu sesuai kebutuhan pasar baik organisasi maupun magang keduanya samasama memiliki keunggulan kekurangan masingmasing berdasarkan apa alami keduanya memiliki keterkaitan satu sama dimulai kenali diri sendiri bangun fondasi lewat organisasi kemudian praktek dunia kerja implementasi soft skill pemahaman selama dunia kampus intinya apapun kamu pilih jangan lupa benarbenar sadari kemampuanmu jangan salah langkah perlahan tetap nikmati perjalananmu selama dunia kampus berlangsung penuh bahagia follow instagram kompasianacom tiktok kompasiana biar ketinggalan event seru komunitas tips cuan kompasiana cerita inspiratif langsung smartphone kamu bergabung whatsapp channel kompasiana sini,orang mahasiswa sadar betul bawah pasuk dunia kampus rupa tepat tingkat mampu individu baik hard skill maupun soft skill kampus jadi tempat mampu beri akses mahasiswa kembang selenggara bagai giat positif tarik salah satu lalu organisasi kampus badan eksekutif mahasiswa bem dewan wakil mahasiswa dpm himpun mahasiswa hima kampus sedia sarana kembang skill mahasiswa bentuk bagai unit giat mahasiswa ukm ikut mahasiswa dasar minat bakat masingmasing bagi mahasiswa milik cara sendiri tingkat skill aktif ikut giat luar kampus ikut giat magang bahkan mahasiswa aktif magang awalawal semester ingat pasar kerja indonesia banyak tuntut mahasiswa milik alam magang lulus buat mahasiswa gencar ikut giat magang dua masalah sebut sedikit nyata mahasiswa rasa dilema tentu mana pilih baik pilih ikut organisasi magang mungkin kamu salah satu izin ulas dasar alam pribadi mahasiswa pernah organ kampus sekaligus mahasiswa kini tengah ikut magang content writer pilih organisasi kamu mahasiswa tahun pertama dua tahun awal kuliah kamu adaptasi lingkung kampus bangun fondasi tepat kamu tingkat soft skill serius skill komunikasi pimpin negosiasi disiplin waktu koordinasi kerjasama tim skill lain tak kalah penting bangun relasi internal relasi kunci hubung baik kamu jalin teman angkat kakak tingkat alumni hingga dosen tingkat peluang oleh banyak informasi mungkin jarang siar publik perlu ingat terkadang semua orang kenal jadi sumber informasi janji pintarpintarlah berjejaring boleh teman siapa pilihpilihlah gaul siapa kamu gaul tentu siapa diri bahkan masa depan coba peran temu minat tepat eksplorasi organisasi biasa dapat struktur organisasi urus ketua sekretaris bendahara maupun divisi departemen bawah tanggung jawab tentu berbedabeda kamu mulai temu calon karirmu sini nyata sedikit orang pegang posisi tentu ranah profesional nyata semua awal organisasi ikut lingkung kampus kabar baik kamu rasa kurang cocok posisi kamu milik tuntut profesional sifat kaku organisasi jawab cocok kamu rasa temu passionmu tarik kelola proyek acara organisasi kampus biasa milik jumlah program kerja laku satu periode urus program kerja ini beri kamu real proyek jadi nilai tambah kamu jadi ketua acara sekretaris giat bendahara giat posisi lain sesuai minat kamu ajar eksekusi buah program awal buat konsep hingga eksekusi giat rencana semua kamu tuntut lihat soft skill hard skill mu perlu ingat organ landas rasa tanggung jawab abai akademik jadi pasti komitmen akhir bentuk serius profesionalisme mu mana bagi soft skill penting pilih magang kamu pasuk minimal semester benar tentu khusus ikut magang semester semester mata kuliah wajib biasa hampir selesai sisa konversi magang fondasi cukup utama posisi magang kait jurus semester kamu cukup mulai ikut magang dapat alam kerja nyata sambung belum empat semester kamu kenyam didik bangku kuliah saat bagi dapat alam kerja nyata kamu implementasi dunia kerja jadi awal baik kamu masuk dunia kerja benar limpah tanggungjawab tentu lebih berat alami sulit magang kamu minta bantu mentor bantu kerja tugas bangun portofolio portofolio macam rekam jejak isi hasil kerja nyata posisi pernah kamu duduk ikut magang kamu milik bukti kalau kamu pernah tanggung jawab laku buah tindak jadi nilai tambah mata hrd kamu kerja ranah profesional bahkan beberapa posisi tentu industri kreatif desain content creator copywriting wajib kamu milik portofolio magang jadi sempat emas bangun nilai luas relasi eksternal kalo organisasi luas jejaring internal sekarang saat show up eksternal temu banyak orang background lebih agam kamu bangun hubung baik hrd manager usaha magang calon atas mentor magang bahkan calon konsumenklien usaha gantung usaha posisi kamu tempat nah waktu tepat buat kamu asah interpersonal skill jadi pribadi senang easy going ajak interaksi ubah status jadi kandidat siap rekrut kalo kamu cocok segi skill punya portofolio tahu bagaimana alur dunia kerja temu posisi match buat kamu tanda kamu udah cocok buat magang ambil posisi serius sesuai kriteria kamu tahap kamu jangan gampang rasa puas terus upgrade biar skill kamu sesuai butuh pasar baik organisasi maupun magang dua samasama milik unggul kurang masingmasing dasar apa alami dua milik kait satu sama mulai kenal diri sendiri bangun fondasi lewat organisasi kemudian praktek dunia kerja implementasi soft skill paham lama dunia kampus inti apa kamu pilih jangan lupa benarbenar sadar mampu jangan salah langkah perlahan tetap nikmat jalan lama dunia kampus langsung penuh bahagia follow instagram kompasianacom tiktok kompasiana biar tinggal event seru komunitas tips cuan kompasiana cerita inspiratif langsung smartphone kamu gabung whatsapp channel kompasiana sini
